Media_Online,Seed_URL,Parent,Anchor,Surrounding,Tanggal_Publish
merdeka,https://m.merdeka.com/bandung/komunitas/bio-farma-terima-apresiasi-dari-ggn-terkait-geopark-ciletuh-180116k.html,"
Merdeka.com, Bandung - Geopark Ciletuh Palabuhanratu, resmi ditetapkan memenuhi kriteria sebagai Taman Bumi Dunia (Global Geopark), penetapan akan dilakukan dalam sidang Executive Board pada tanggal 4 hingga 17 April 2018. Pencapaian tersebut tidak lepas dari pihak-pihak yang terlibat aktif dari sejak awal pengembangan Geopark Ciletuh Palabuhanratu seperti, Pemerintah Provinsi Jawa Barat, Pemerintah Kabupaten Sukabumi, Bio Farma, Universitas Padjadjaran, Masyarakat dan Komunitas Lokal di kawasan Geopark.


Terkait penetapan tersebut, pada 3 Januari 2018 Bio Farma telah menerima apresiasi dalam bentuk surat resmi dari Global Geopark Network (GGN) yang ditanda tangani oleh Guy Martini selaku Sekjen GGN yang berkantor pusat di Paris.
""Saya menyampaikan apresiasi kepada Bio Farma atas dukungannya pada UNESCO Global Geopark Project di Indonesia. Ide mengenai kerja sama sektor swasta dengan masyarakat sekitar, melalui pemberdayaan dan pengembangan kawasan Geopark tersebut sangat penting,"" ujar Guy dari siaran berita yang diterima Merdeka Bandung, Selasa (16/1).
Bentuk kerja sama antara Bio Farma dengan Geopark Ciletuh Pelabuhan Ratu dapat dijadikan sebagai percontohan. Bagaimana sektor swasta terlibat aktif dalam menciptakan dan mengembangkan geopark yang sehat di Indonesia.
R.Herry, selaku Kepala Divisi Pengelolaan Lingkungan dan Sosial Bio Farma, yang beberapa tahun terakhir telah diberikan tugas oleh Bio Farma untuk terlibat dalam berbagai program CSR dan pengembangan masyarakat di Geopark Ciletuh Palabuhanratu.
""Kami menyambut positif dan bangga dengan keputusan bahwa Geopark Ciletuh Palabuhanratu memenuhi kriteria sebagai Taman Bumi Dunia (Global Geopark) oleh UNESCO, kami telah menginisiasi Pengembangan Geopark Ciletuh Palabuhanratu sejak awal,"" papar Herry.
Apa yang telah dilakukan Bio Farma antara lain, lanjutnya, dalam pemberdayaan masyarakat lokal, kami mensubstitusi pekerjaan penambang ilegal yang kemudian berkecimpung dan berprofesi dalam bidang Geo Wisata.
“Selain itu melakukan pengembangan lingkungan di kawasan Geopark CIletuh Palabuhanratu, seperti pengembangan Geo Wisata, pengembangan desa binaan, pengembangan homestay,"" jelas dia.
Herry menambahkan, pengembangan aspek keanekaragaman budaya oleh Bio Farma melalui Batik Ramah Lingkungan, Batik Pakidulan, promosi dan sosialisasi Geopark Ciletuh Palabuhanratu, pendampingan proses pengajuan dan evaluasi Global Geopark Network, serta pengembangan masyarakat yang bersinergi dengan komunitas lokal.
Dalam aspek Bio diversity Bio Farma juga berperan aktif dalam pelestarian Flora dan Fauna di kawasan Ciletuh seperti penanaman pohon mangrove, penanaman pohon kepuh, serta program konservasi dalam bentuk peningkatan keanekaragaman hayati di Suaka Marga Satwa Cikepuh. "," Tingkatkan Upaya Penghijauan dan Bantu Kelestarian Alam, Jasa Marga Tanam 42 Tanaman   Sungai di Bandung Banyak Alami Penyempitan  Pemkot Bandung Godok Perwal Larangan Penggunaan Kantong Plastik  Forbat tolak komersialisasi HLT di kawasan Bandung Utara  Situ Cisanti makin cantik ditanami bunga oleh para mahasiswa   Tauzia Hotel ajak warga Bandung ikut mematikan listrik selama 60 menit  Pemkot Bandung akan bangun kawasan agrowisata di wilayah Bandung timur  Tangani sampah Pemkot Bandung hadirkan TPST canggih di Tegalega  Pengelolaan lingkungan Kota Bandung diapresiasi Menteri LHK  PLN Jabar dukung edukasi pengelolaan sampah untuk anak sekolah  Wisata Budaya Forum ini menjaga kelestarian budaya Sunda lewat Twitter  Komunitas Sahabat Museum KAA, tularkan spirit pada masyarakat  Komunitas Ubah kesan kumuh, komunitas ini manfaatkan halte jadi taman bacaan  Komunitas Komunitas Aleut, mencintai sejarah kota dengan cara berbeda  Komunitas Seru-seruan menggambar bareng Komunitas Pensil dan Kertas Bandung  Unik Begini aksi seru kegiatan Komunitas Kompakersbandung  Komunitas Suka berpetualang? gabung di Komunitas The Young Glove  Komunitas Hebat, dua anak muda ini ngajar anak jalanan tanpa dibayar  Komunitas Komunitas LayarKita, tempat berkumpulnya moviegoers di Bandung  Komunitas Ingin belajar drone? Gabung saja di Komunitas Kutilang Dara  Komunitas Mencintai sungai dengan membuka sekolah berbasis lingkungan  Komunitas Belajar ukulele bareng Komunitas Ukeba di Bandung  Komunitas Komunitas Hong, surga permainan tradisional di Bandung  Komunitas Komunitas ini punya tips hebat, bisa bikin anak-anak rajin baca  Komunitas Belajar sejarah secara unik dengan komunitas Historia van Bandoeng  Komunitas Mengamati burung di alam bebas bersama Komunitas Bicons  Makanan Mengintip kopi darat komunitas pemburu kuliner Bandung  Komunitas Suka naik bus Damri ? Wajib gabung di komunitas ini  Bingung cara melatih anjing, gabung yuk di komunitas High Five  Komunitas Komunitas ini cocok untuk Anda yang suka berkebun, ikutan yuk",none,none
