Media_Online,Seed_URL,Parent,Anchor,Surrounding,Tanggal_Publish
merdeka,https://www.merdeka.com/peristiwa/amphitheatre-geopark-ciletuh-diakselerasi-rampung-sebelum-evaluasi-unesco.html,"
Merdeka.com -  Pemerintah Provinsi Jawa Barat berencana mengakselerasi infrastruktur di kawasan Geopark Ciletuh Palabuhanratu. Salah satu yang akan diselesaikan tahun ini adalah pembangunan amphitheatre sebagai penunjang pertunjukan seni budaya.
Kepala Dinas Pariwisata dan Kebudayaan (Disparbud) Jawa Barat, Dedi Taufik, mengatakan kebutuhan anggaran untuk merealisasikannya sebesar Rp 12,6 miliar yang dialokasikan dari anggaran perubahan tahun 2019. Selain amphitheatre, sejumlah sarana penunjang dan amenitas pun diperbanyak.
""Ada beberapa hal yang harus kita akselerasi, seperti amphitheatre untuk menunjang pertunjukan seni budaya. Semua pekerjaannya akan diawasi dengan ketat agar tidak merusak alam yang ada di sana. Selain itu, rambu petunjuk dan toilet akan ditambah,"" katanya saat dihubungi, Jumat (5/7).
""Yang pasti, kami tetap menjaga komitmen melakukan konservasi. Pembangunan mengikuti pola tata ruang yang sudah ditentukan. Aspek edukasi, pembelajaran geologi, biologi, kebudayaan tetap berjalan,"" jelasnya.
Upaya tersebut merupakan pengembangan sekaligus menjaga status Geopark Ciletuh Palabuhanratu di Kabupaten Sukabumi sebagai Unesco Global Geopark (UGG). Sejak mendapat predikat UGG pada tahun 2018, pihak Unesco akan melakukan evaluasi berkala pada tahun 2020.
Bersamaan dengan akselerasi tersebut, ia berharap proyek penunjang seperti pembangunan Pelabuhan Laut Pengumpan Regional (PLPR) di Pantai kawasan Pantai Karang Pamulang, Kecamatan Palabuhanratu bisa selesai. Fasilitas ini dibangun untuk menunjang angkutan laut yang menghubungkan antara Palabuhanratu dengan Jakarta.
Lebih lanjut, Dedi Taufik, menyebut selain Geopark Ciletuh Palabuhanratu, kawasan serupa tetap akan diperhatikan dan dikembangkan. Kawasan tersebut adalah Geopark Nasional Pongkor, Geopark Pangandaran, Geopark Galunggung Sepuluh Ribu Bukit dan Geopark Karst Rajamandala.
""Pemerintah pusat juga berkomitmen mendukung. Mereka akan membantu melalui tim khusus untuk geopark,"" ucapnya.
Dedi menyatakan bahwa aspek lingkungan, sosial budaya, dan ekonomi harus menjadi perhatian utama dalam pengembangan geopark sesuai dengan tiga pilar pengembangan geopark yaitu konservasi, edukasi, dan pembangunan ekonomi masyarakat secara berkelanjutan.
""Geopark sebagai sebuah produk wisata perlu terus dikelola melalui konsep pengembangan yang holistik dan integratif karena bersifat lintas sektor. Jabar harus terus menggenjot pertumbuhan ekonomi melalui sektor pariwisata dan geopark di Jabar memiliki peluang yang sangat tinggi untuk terus dikembangkan,"" ucapnya.
""Dibutuhkan kerjasama dan komitmen bersama antara Pemerintah Pusat, Provinsi, Kabupaten Kota, dan seluruh pihak terkait termasuk masyarakat untuk mengembangkan potensi geopark ini menjadi sumber peningkatan pertumbuhan ekonomi berkelanjutan melalui pengembangan pariwisata,"" pungkasnya. [lia]
",Objek Wisata Wisata Alam Pariwisata Indonesia Wisata Indonesia Jakarta,Destinasi Wisata Wisata Jatim Ragam Jateng Mojokerto Jatim Pariwisata Indonesia Objek Wisata Lokasi Wisata Sejarah Yogyakarta Destinasi Wisata Wisata Jatim Ragam Jateng Mojokerto Jatim Pariwisata Indonesia Objek Wisata Lokasi Wisata Sejarah Yogyakarta Ragam Jatim Yogyakarta Tempat Wisata Wisata Alam Brebes Pariwisata Indonesia Destinasi Wisata Objek Wisata Ragam Jatim Yogyakarta Tempat Wisata Wisata Alam Brebes Pariwisata Indonesia Destinasi Wisata Objek Wisata Jateng Berita Jateng Ragam Objek Wisata Jateng Berita Jateng Ragam Objek Wisata Jabar Ragam Destinasi Wisata Wisata Alam Tempat Wisata Objek Wisata Pariwisata Indonesia Yogyakarta Jabar Ragam Destinasi Wisata Wisata Alam Tempat Wisata Objek Wisata Pariwisata Indonesia Yogyakarta Jateng DIY Berita Wisata Candi Semarang Pariwisata Indonesia Objek Wisata Tempat Wisata Sejarah Peninggalan Sejarah Lokasi Wisata Sejarah Situs Sejarah Jateng DIY Berita Wisata Candi Semarang Pariwisata Indonesia Objek Wisata Tempat Wisata Sejarah Peninggalan Sejarah Lokasi Wisata Sejarah Situs Sejarah Jabar Berita Indramayu Singapura Pariwisata Indonesia Objek Wisata Tempat Wisata Yogyakarta Jabar Berita Indramayu Singapura Pariwisata Indonesia Objek Wisata Tempat Wisata Yogyakarta Objek Wisata Destinasi Wisata Pariwisata Indonesia Banjarnegara Objek Wisata Destinasi Wisata Pariwisata Indonesia Banjarnegara Gunung Semeru Wisata Alam Pariwisata Indonesia Objek Wisata Tempat Wisata Jabar Ragam Yogyakarta Gunung Semeru Wisata Alam Pariwisata Indonesia Objek Wisata Tempat Wisata Jabar Ragam Yogyakarta Danau Toba Luhut Panjaitan Pariwisata Indonesia Sumut Wisata Sumut Objek Wisata Tempat Wisata Wisata Alam Danau Toba Luhut Panjaitan Pariwisata Indonesia Sumut Wisata Sumut Objek Wisata Tempat Wisata Wisata Alam Wisata Alam Wisata Sumut Objek Wisata Sumut Berita Yogyakarta Wisata Alam Wisata Sumut Objek Wisata Sumut Berita Yogyakarta Jabar Ragam Objek Wisata Wisata Ubud Wisata Indonesia Yogyakarta Jabar Ragam Objek Wisata Wisata Ubud Wisata Indonesia Yogyakarta Palembang Pariwisata Indonesia Wisata Alam Wisata Indonesia Objek Wisata Wisata Unik Objek Wisata Religi Wisata Sumut Sumatera Ragam Ragam Konten Trending Yogyakarta Palembang Pariwisata Indonesia Wisata Alam Wisata Indonesia Objek Wisata Wisata Unik Objek Wisata Religi Wisata Sumut Sumatera Ragam Ragam Konten Trending Yogyakarta Travel Objek Wisata Wisata Alam Garut Travel Objek Wisata Wisata Alam Garut Danau Toba Sumut Wisata Sumut Yogyakarta Pariwisata Indonesia Wisata Alam Objek Wisata Danau Toba Sumut Wisata Sumut Yogyakarta Pariwisata Indonesia Wisata Alam Objek Wisata Wisata Alam Objek Wisata Tempat Wisata Wisata Sumut Sumut Wisata Alam Objek Wisata Tempat Wisata Wisata Sumut Sumut Jabar Ragam Wisata Alam Destinasi Wisata Probolinggo Wisata Pantai Air Terjun Madakaripura Objek Wisata Yogyakarta Jabar Ragam Wisata Alam Destinasi Wisata Probolinggo Wisata Pantai Air Terjun Madakaripura Objek Wisata Yogyakarta Madura Wisata Alam Ragam Jateng Pariwisata Indonesia Destinasi Wisata Objek Wisata Tempat Wisata Jawa Timur Wisata Jatim Yogyakarta Madura Wisata Alam Ragam Jateng Pariwisata Indonesia Destinasi Wisata Objek Wisata Tempat Wisata Jawa Timur Wisata Jatim Yogyakarta Ragam Jatim Yogyakarta Tempat Wisata Batu Museum Pariwisata Indonesia Destinasi Wisata Objek Wisata Ragam Jatim Yogyakarta Tempat Wisata Batu Museum Pariwisata Indonesia Destinasi Wisata Objek Wisata Picture First Wisata Alam Yogyakarta Picture First Wisata Alam Yogyakarta Sumut Ragam Wisata Jateng Wisata Alam Banyumas Yogyakarta Sumut Ragam Wisata Jateng Wisata Alam Banyumas Yogyakarta Ragam Jatim Yogyakarta Tempat Wisata Wisata Alam Brebes Pariwisata Indonesia Destinasi Wisata Objek Wisata Ragam Jatim Yogyakarta Tempat Wisata Wisata Alam Brebes Pariwisata Indonesia Destinasi Wisata Objek Wisata Jabar Ragam Destinasi Wisata Wisata Alam Tempat Wisata Objek Wisata Pariwisata Indonesia Yogyakarta Jabar Ragam Destinasi Wisata Wisata Alam Tempat Wisata Objek Wisata Pariwisata Indonesia Yogyakarta Wisata Alam Wisata Sumut Destinasi Wisata Tempat Wisata Sumut Wisata Alam Wisata Sumut Destinasi Wisata Tempat Wisata Sumut Wisata Alam Wisata Sumut Tempat Wisata Sumut Wisata Alam Wisata Sumut Tempat Wisata Sumut Jabar Berita Banten Pariwisata Indonesia Wisata Unik Destinasi Wisata Wisata Alam Yogyakarta Jabar Berita Banten Pariwisata Indonesia Wisata Unik Destinasi Wisata Wisata Alam Yogyakarta Jateng DIY Berita Unik Kuliner Unik Tempat Unik Wisata Unik Jabar Wisata Alam Majalengka Jateng DIY Berita Unik Kuliner Unik Tempat Unik Wisata Unik Jabar Wisata Alam Majalengka Sandiaga Uno Danau Toba Sumut Pariwisata Indonesia Menteri Pariwisata Kementerian Pariwisata Wisata Sumut Tempat Wisata Wisata Alam Sandiaga Uno Danau Toba Sumut Pariwisata Indonesia Menteri Pariwisata Kementerian Pariwisata Wisata Sumut Tempat Wisata Wisata Alam Gunung Semeru Wisata Alam Pariwisata Indonesia Objek Wisata Tempat Wisata Jabar Ragam Yogyakarta Gunung Semeru Wisata Alam Pariwisata Indonesia Objek Wisata Tempat Wisata Jabar Ragam Yogyakarta Danau Toba Luhut Panjaitan Pariwisata Indonesia Sumut Wisata Sumut Objek Wisata Tempat Wisata Wisata Alam Danau Toba Luhut Panjaitan Pariwisata Indonesia Sumut Wisata Sumut Objek Wisata Tempat Wisata Wisata Alam Wisata Alam Wisata Sumut Objek Wisata Sumut Berita Yogyakarta Wisata Alam Wisata Sumut Objek Wisata Sumut Berita Yogyakarta Palembang Pariwisata Indonesia Wisata Alam Wisata Indonesia Objek Wisata Wisata Unik Objek Wisata Religi Wisata Sumut Sumatera Ragam Ragam Konten Trending Yogyakarta Palembang Pariwisata Indonesia Wisata Alam Wisata Indonesia Objek Wisata Wisata Unik Objek Wisata Religi Wisata Sumut Sumatera Ragam Ragam Konten Trending Yogyakarta Pariwisata Indonesia Wisata Bandung Wisata Alam Jabar Picture First Ragam Story Yogyakarta Pariwisata Indonesia Wisata Bandung Wisata Alam Jabar Picture First Ragam Story Yogyakarta Wisata Alam Bogor Unik Wisata Unik Gunung Salak Sawah Pemandangan Alam Viral Hari Ini VIRAL Foto Viral Ragam Konten Trending Yogyakarta Wisata Alam Bogor Unik Wisata Unik Gunung Salak Sawah Pemandangan Alam Viral Hari Ini VIRAL Foto Viral Ragam Konten Trending Yogyakarta Travel Objek Wisata Wisata Alam Garut Travel Objek Wisata Wisata Alam Garut Danau Toba Sumut Wisata Sumut Yogyakarta Pariwisata Indonesia Wisata Alam Objek Wisata Danau Toba Sumut Wisata Sumut Yogyakarta Pariwisata Indonesia Wisata Alam Objek Wisata Sumut Wisata Sumut Wisata Alam Pariwisata Indonesia Yogyakarta Sumut Wisata Sumut Wisata Alam Pariwisata Indonesia Yogyakarta Pariwisata Indonesia Kemenparekraf Ekonomi Indonesia Pertumbuhan Industri Jakarta Sandiaga Salahuddin Uno Pariwisata Indonesia Kemenparekraf Ekonomi Indonesia Pertumbuhan Industri Jakarta Sandiaga Salahuddin Uno Pariwisata Indonesia Sandiaga Uno Ekonomi Indonesia Kemenparekraf Jakarta Sandiaga Salahuddin Uno Pariwisata Indonesia Sandiaga Uno Ekonomi Indonesia Kemenparekraf Jakarta Sandiaga Salahuddin Uno Pariwisata Indonesia Virus Corona The New Normal Kemenparekraf Liputan6.com Ekonomi Indonesia Jakarta Dampak Corona Pariwisata Indonesia Virus Corona The New Normal Kemenparekraf Liputan6.com Ekonomi Indonesia Jakarta Dampak Corona Pariwisata Indonesia Covid 19 Ekonomi Indonesia Kemenparekraf Jakarta Virus Corona Dampak Corona Pariwisata Indonesia Covid 19 Ekonomi Indonesia Kemenparekraf Jakarta Virus Corona Dampak Corona Wisatawan Asing Pariwisata Indonesia Kemenparekraf Virus Corona Liputan6.com Ekonomi Indonesia Jakarta Wisatawan Asing Pariwisata Indonesia Kemenparekraf Virus Corona Liputan6.com Ekonomi Indonesia Jakarta Jawa Timur Jatim Berita Wisata Jatim Probolinggo Himalaya Nepal Pariwisata Indonesia Wisata Unik Yogyakarta Jawa Timur Jatim Berita Wisata Jatim Probolinggo Himalaya Nepal Pariwisata Indonesia Wisata Unik Yogyakarta Jatim Berita Banyuwangi Berita Banyuwangi Pariwisata Indonesia Wisata Jatim Puan Maharani Ketua DPR Puan Maharani Yogyakarta Jatim Berita Banyuwangi Berita Banyuwangi Pariwisata Indonesia Wisata Jatim Puan Maharani Ketua DPR Puan Maharani Yogyakarta UMKM UKM Pariwisata Indonesia Kemenparekraf Sandiaga Uno Ekonomi Indonesia Jakarta Sandiaga Salahuddin Uno UMKM UKM Pariwisata Indonesia Kemenparekraf Sandiaga Uno Ekonomi Indonesia Jakarta Sandiaga Salahuddin Uno Luhut Panjaitan Pariwisata Indonesia Jakarta Luhut Panjaitan Pariwisata Indonesia Jakarta Menko Perekonomian Airlangga Hartarto Pariwisata Indonesia Dampak Corona Jakarta Airlangga Hartarto Menko Perekonomian Airlangga Hartarto Pariwisata Indonesia Dampak Corona Jakarta Airlangga Hartarto Vaksin Covid 19 Bali Sandiaga Uno Pariwisata Indonesia Ekonomi Indonesia Jakarta Vaksin Corona Pariwisata Bali Kemenparekraf Vaksin Covid 19 Bali Sandiaga Uno Pariwisata Indonesia Ekonomi Indonesia Jakarta Vaksin Corona Pariwisata Bali Kemenparekraf BPS Pariwisata Bali Pariwisata Indonesia Dampak Corona Wisatawan Asing Jakarta BPS Pariwisata Bali Pariwisata Indonesia Dampak Corona Wisatawan Asing Jakarta Pariwisata Bali Virus Corona Ekonomi Indonesia Jakarta Dampak Corona Pariwisata Indonesia Pariwisata Bali Virus Corona Ekonomi Indonesia Jakarta Dampak Corona Pariwisata Indonesia Pariwisata Indonesia Bali Wisatawan Asing Sandiaga Uno Kemenparekraf Ekonomi Indonesia Jakarta Dampak Corona Pariwisata Indonesia Bali Wisatawan Asing Sandiaga Uno Kemenparekraf Ekonomi Indonesia Jakarta Dampak Corona Pariwisata Indonesia Infrastruktur Makassar Pariwisata Indonesia Infrastruktur Makassar BPS Pesawat Terbang Transportasi Umum Virus Corona Tes Corona Ekonomi Indonesia Pariwisata Indonesia Jakarta BPS Pesawat Terbang Transportasi Umum Virus Corona Tes Corona Ekonomi Indonesia Pariwisata Indonesia Jakarta Presiden Jokowi KRL Yogyakarta Solo Transportasi Umum Pariwisata Indonesia Pariwisata Yogyakarta Joko Widodo Presiden Jokowi KRL Yogyakarta Solo Transportasi Umum Pariwisata Indonesia Pariwisata Yogyakarta Joko Widodo Covid 19 Ingat Pesan Ibu Virus Corona Vaksin Covid 19 Vaksin Corona Pariwisata Indonesia Dampak Corona Sandiaga Uno Kemenparekraf Jakarta Sandiaga Salahuddin Uno Covid 19 Ingat Pesan Ibu Virus Corona Vaksin Covid 19 Vaksin Corona Pariwisata Indonesia Dampak Corona Sandiaga Uno Kemenparekraf Jakarta Sandiaga Salahuddin Uno Destinasi Wisata Wisata Jatim Ragam Jateng Mojokerto Jatim Pariwisata Indonesia Objek Wisata Lokasi Wisata Sejarah Yogyakarta Destinasi Wisata Wisata Jatim Ragam Jateng Mojokerto Jatim Pariwisata Indonesia Objek Wisata Lokasi Wisata Sejarah Yogyakarta Jabar Ragam Objek Wisata Wisata Ubud Wisata Indonesia Yogyakarta Jabar Ragam Objek Wisata Wisata Ubud Wisata Indonesia Yogyakarta Palembang Pariwisata Indonesia Wisata Alam Wisata Indonesia Objek Wisata Wisata Unik Objek Wisata Religi Wisata Sumut Sumatera Ragam Ragam Konten Trending Yogyakarta Palembang Pariwisata Indonesia Wisata Alam Wisata Indonesia Objek Wisata Wisata Unik Objek Wisata Religi Wisata Sumut Sumatera Ragam Ragam Konten Trending Yogyakarta Libur Panjang Imlek Ancol Taman Ragunan Ragam Konten Corona Covid Tahun Baru Imlek Pariwisata Indonesia Wisata Indonesia Jakarta Libur Panjang Imlek Ancol Taman Ragunan Ragam Konten Corona Covid Tahun Baru Imlek Pariwisata Indonesia Wisata Indonesia Jakarta Wisata Indonesia Banjarmasin Covid 19 Wisata Indonesia Banjarmasin Covid 19 Wisata Bandung Jabar Ragam Wisata Kuliner Bandung Kuliner Bandung Pariwisata Indonesia Wisata Indonesia Destinasi Wisata Destinasi Travelling Yogyakarta Wisata Bandung Jabar Ragam Wisata Kuliner Bandung Kuliner Bandung Pariwisata Indonesia Wisata Indonesia Destinasi Wisata Destinasi Travelling Yogyakarta Ancol PSBB Jakarta Covid 19 Objek Wisata Wisata Indonesia The New Normal Jakarta Ancol PSBB Jakarta Covid 19 Objek Wisata Wisata Indonesia The New Normal Jakarta Pariwisata Indonesia Lokasi Wisata Objek Wisata Wisata Indonesia Wisata Alam Danau Toba Sumut Pariwisata Indonesia Lokasi Wisata Objek Wisata Wisata Indonesia Wisata Alam Danau Toba Sumut Wisata Indonesia Wisata Pantai Kisah Inspiratif Kisah Unik Sumut NTT Cerita Inspiratif Wisata Indonesia Wisata Pantai Kisah Inspiratif Kisah Unik Sumut NTT Cerita Inspiratif Jateng DIY Berita Wisata Jogja Gunung Merapi Wisata Indonesia Wisata Alam Sleman Jateng DIY Berita Wisata Jogja Gunung Merapi Wisata Indonesia Wisata Alam Sleman Jawa Timur Jatim Wisata Jatim Lamongan Wisata Indonesia Yogyakarta Jawa Timur Jatim Wisata Jatim Lamongan Wisata Indonesia Yogyakarta Jateng DIY Berita Objek Wisata Semarang Wisata Indonesia Semarang Jateng DIY Berita Objek Wisata Semarang Wisata Indonesia Semarang Budaya Indonesia Papua Wisata Indonesia Desa Wisata Berita Jabar Yogyakarta Budaya Indonesia Papua Wisata Indonesia Desa Wisata Berita Jabar Yogyakarta Jabar Berita Wisata Indonesia Bandung Kolam Renang Viral Hari Ini VIRAL Kisah Horor Wisata Bandung Jawa Barat Yogyakarta Jabar Berita Wisata Indonesia Bandung Kolam Renang Viral Hari Ini VIRAL Kisah Horor Wisata Bandung Jawa Barat Yogyakarta Jateng DIY Berita The New Normal Taman Bunga Baturraden Pariwisata Indonesia Wisata Indonesia Tujuan Pariwisata Wisata Alam Banyumas Jateng DIY Berita The New Normal Taman Bunga Baturraden Pariwisata Indonesia Wisata Indonesia Tujuan Pariwisata Wisata Alam Banyumas Jateng DIY Berita Kepulauan Karimunjawa Hewan Langka Wisata Alam Wisata Indonesia Jepara Jateng DIY Berita Kepulauan Karimunjawa Hewan Langka Wisata Alam Wisata Indonesia Jepara Jawa Timur Jatim Wisata Indonesia Wisata Alam Situbondo Perkebunan Berita Yogyakarta Jawa Timur Jatim Wisata Indonesia Wisata Alam Situbondo Perkebunan Berita Yogyakarta Jateng DIY Berita Covid 19 Corona The New Normal Taman Bunga Baturraden Pariwisata Indonesia Wisata Indonesia Lokasi Wisata Dampak Corona Banyumas Jateng DIY Berita Covid 19 Corona The New Normal Taman Bunga Baturraden Pariwisata Indonesia Wisata Indonesia Lokasi Wisata Dampak Corona Banyumas Budaya Indonesia Pariwisata Indonesia Wisata Indonesia Teluk Dalam Nias Selatan Sumut Budaya Indonesia Pariwisata Indonesia Wisata Indonesia Teluk Dalam Nias Selatan Sumut Pulau Komodo Corona Di Indonesia Pariwisata Indonesia Wisata Indonesia Jakarta Pulau Komodo Corona Di Indonesia Pariwisata Indonesia Wisata Indonesia Jakarta Kemelut Demokrat Kisruh Demokrat Partai Demokrat KLB Demokrat Polri Jakarta Kemelut Demokrat Kisruh Demokrat Partai Demokrat KLB Demokrat Polri Jakarta Vaksin Covid 19 Jakarta Vaksin Covid 19 Jakarta BBM Premium SPBU Jakarta BBM Premium SPBU Jakarta Kementerian Kelautan Dan Perikanan Berita Kementerian KKP Jakarta Kementerian Kelautan Dan Perikanan Berita Kementerian KKP Jakarta PPKM Menko Perekonomian Airlangga Hartarto Pertumbuhan Ekonomi Ekonomi Indonesia Jakarta PPKM Menko Perekonomian Airlangga Hartarto Pertumbuhan Ekonomi Ekonomi Indonesia Jakarta China Muslim Uighur Uighur Xinjiang Ragam Konten Jakarta China Muslim Uighur Uighur Xinjiang Ragam Konten Jakarta Kemelut Demokrat Kisruh Demokrat Partai Demokrat KLB Demokrat Nazaruddin Moeldoko Ragam Konten Jakarta Kemelut Demokrat Kisruh Demokrat Partai Demokrat KLB Demokrat Nazaruddin Moeldoko Ragam Konten Jakarta KLB Demokrat Partai Demokrat Protokol Kesehatan Jakarta KLB Demokrat Partai Demokrat Protokol Kesehatan Jakarta Covid 19 Ingat Pesan Ibu Jakarta Covid 19 Ingat Pesan Ibu Jakarta Kemelut Demokrat Kisruh Demokrat Partai Demokrat KLB Demokrat Jakarta Kemelut Demokrat Kisruh Demokrat Partai Demokrat KLB Demokrat Jakarta Partai Demokrat KLB Demokrat Kisruh Demokrat Moeldoko AHY Jakarta Partai Demokrat KLB Demokrat Kisruh Demokrat Moeldoko AHY Jakarta Jasa Marga Mobil Listrik Tol Trans Jawa Jakarta Jasa Marga Mobil Listrik Tol Trans Jawa Jakarta Jokowi Minta Benci Produk Luar Negeri Ekspor Impor Ekonomi Indonesia Jakarta Jokowi Minta Benci Produk Luar Negeri Ekspor Impor Ekonomi Indonesia Jakarta Helena Lim Vaksin Covid 19 Vaksin Corona Vaksinasi Covid 19 Video Viral Viral Hari Ini VIRAL Jakarta Helena Lim Vaksin Covid 19 Vaksin Corona Vaksinasi Covid 19 Video Viral Viral Hari Ini VIRAL Jakarta Bank Permata Perbankan Jakarta Bank Permata Perbankan Jakarta Kisruh Demokrat Partai Demokrat KLB Demokrat Moeldoko Jakarta Kisruh Demokrat Partai Demokrat KLB Demokrat Moeldoko Jakarta Covid 19 Ingat Pesan Ibu Jakarta Covid 19 Ingat Pesan Ibu Jakarta Covid 19 Virus Corona DKI Jakarta Jakarta Covid 19 Virus Corona DKI Jakarta Jakarta,"Sabtu, 6 Juli 2019 05:03"
merdeka,https://www.merdeka.com/gaya/jelajah-alam-dan-budaya-lewat-festival-geopark-ciletuh-2015.html,"
Merdeka.com -  Festival Geopark Ciletuh 2015 tidak hanya disiapkan sebagai ajang jelajah keindahan alam, tetapi juga sebagai wisata budaya. Itu sebabnya festival ini bertema ""Exploring Ciletuh"" yang diartikan sebagai wahana festival untuk mengetahui potensi kawasan Ciletuh baik lewat penjelajahan potensi budaya maupun potensi alam.Kepala Dinas Pariwisata dan Kebudayaan (Disparbud) Provinsi Jawa Barat Nunung Sobari, mengatakan potensi budaya tersebut berupa produk budaya seperti kesenian, situs, sarana, agen sosial yang potensial dan sejenisnya dan dapat dimanfaatkan sebagai penguat pariwisata.""Sedangkan potensi alam adalah potensi yang dapat dimanfaatkan untuk pariwisata, seperti lanskap ruang, bentangan, tebing, udara, maupun potensi yang ada di air, seperti sungai, pantai dan laut,"" kata Nunung, melalui rilis yang diterima Merdeka Bandung.Berbagai acara yang disiapkan dalam Festival Geopark Ciletuh 2015 meliputi Helaran Budaya Pajampangan, Rampak Lodong, Panggung Hiburan Rakyat, Atraksi Paralayang, Atraksi Panjat Tebing, Atraksi Susur Pantai, dan ditutup dengan aksi Sadar Wisata dan penanaman Pohon Kepuh.Pada 25 Oktober – 13 November, lanjut dia, juga dijadwalkan program Pembinaan Homestay dan Kuliner di Desa Ciwaru Ciemas; pembinaan Manajemen Event Desa Ciwaru Ciemas; Sosialisasi Event Ciletuh Geopark Festival Desa Tamanjaya Ciemas. Seluruh acara itu digelar di Kabupaten Sukabumi.Selain itu, disosialisasikan pula Geopark Ciletuh di Hotel Augusta Pelabuhan Ratu; Pencatatan Potensi Pariwisata dan Budaya di Kecamatan Ciemas dan Kecamatan Ciracap, keduanya di Kabupaten Sukabumi; dan Pameran Promosi Potensi Pariwisata Ciletuh di Plaza Trans Studio Mall Bandung, dan lain-lain.""Untuk mendukung Festival Geopark Ciletuh 2015 ini, kami bekerja sama dengan berbagai komunitas lokal dan nasional,"" katanya. Komunitas yang digandeng diantaranya Komunitas Paralayang, Komunitas Panjat Tebing, Komunitas Susur Pantai, Komunitas Pecinta Budaya, Komunitas Pecinta Alam. [mtf]
",Merdeka Bandung Bandung,Ridwan Kamil Merdeka Bandung Bandung Ridwan Kamil Merdeka Bandung Bandung Merdeka Bandung Bandung Merdeka Bandung Bandung Ridwan Kamil Infrastruktur Merdeka Bandung Bandung Ridwan Kamil Infrastruktur Merdeka Bandung Bandung Merdeka Bandung Bandung Dedi Mulyadi Merdeka Bandung Bandung Dedi Mulyadi Merdeka Bandung Persib Bandung Piala Jenderal Soedirman Piala Jenderal Sudirman Bandung Merdeka Bandung Persib Bandung Piala Jenderal Soedirman Piala Jenderal Sudirman Bandung Merdeka Bandung Bandung Merdeka Bandung Bandung Merdeka Bandung Bandung Persib Bandung Umuh Muchtar Merdeka Bandung Bandung Persib Bandung Umuh Muchtar Merdeka Bandung Bandung Merdeka Bandung Bandung Merdeka Bandung Bandung Merdeka Bandung Bandung Merdeka Bandung Persib Bandung Viking Pusamania Borneo Fc Piala Jenderal Sudirman Piala Jenderal Soedirman Bandung Merdeka Bandung Persib Bandung Viking Pusamania Borneo Fc Piala Jenderal Sudirman Piala Jenderal Soedirman Bandung Merdeka Bandung Bandung PON XIX Di Jawa Barat 2016 PSSI Merdeka Bandung Bandung PON XIX Di Jawa Barat 2016 PSSI Merdeka Bandung Produk Indonesia Masyarakat Ekonomi ASEAN Bandung Merdeka Bandung Produk Indonesia Masyarakat Ekonomi ASEAN Bandung Merdeka Bandung Makan Konate Persib Bandung Djadjang Nurdjaman Bandung Merdeka Bandung Makan Konate Persib Bandung Djadjang Nurdjaman Bandung Merdeka Bandung Hari Guru Indonesia Ridwan Kamil Bandung Merdeka Bandung Hari Guru Indonesia Ridwan Kamil Bandung Merdeka Bandung Bandung Merdeka Bandung Bandung Merdeka Bandung Produk Indonesia Bank Indonesia Bandung Merdeka Bandung Produk Indonesia Bank Indonesia Bandung Merdeka Bandung Ekspor Impor Pertanian Bandung Merdeka Bandung Ekspor Impor Pertanian Bandung Merdeka Bandung Bandung Merdeka Bandung Bandung Merdeka Bandung Bandung Merdeka Bandung Bandung Pencurian Bandung Pencurian Bandung Kemelut Demokrat Kisruh Demokrat KLB Demokrat Partai Demokrat Ragam Konten Bandung Kemelut Demokrat Kisruh Demokrat KLB Demokrat Partai Demokrat Ragam Konten Bandung Jabar Berita Bandung VIRAL Game Catur Yogyakarta Jabar Berita Bandung VIRAL Game Catur Yogyakarta Ridwan Kamil Ragam Konten Bandung Ridwan Kamil Ragam Konten Bandung TNI Ragam Konten Bandung TNI Ragam Konten Bandung E Money Pungutan Liar Ragam Konten Bandung E Money Pungutan Liar Ragam Konten Bandung Penjambretan Kriminal Bandung Penjambretan Kriminal Bandung Desy Ratnasari Pilgub Jabar Ragam Konten Partai Amanat Nasional Bandung Desy Ratnasari Pilgub Jabar Ragam Konten Partai Amanat Nasional Bandung Ridwan Kamil Partai Amanat Nasional Pilgub Jabar Bandung Ridwan Kamil Partai Amanat Nasional Pilgub Jabar Bandung Corona Covid Corona Di Indonesia Karawang TKI Ragam Konten Virus Corona Corona Covid 19 Bandung Corona Covid Corona Di Indonesia Karawang TKI Ragam Konten Virus Corona Corona Covid 19 Bandung Video Viral TNI Ragam Konten Bandung Video Viral TNI Ragam Konten Bandung Video Viral TNI Ragam Konten Bandung Video Viral TNI Ragam Konten Bandung Corona Di Indonesia Corona Covid Covid 19 Ragam Konten Ridwan Kamil Virus Corona Corona Sembuh Corona Bandung Corona Di Indonesia Corona Covid Covid 19 Ragam Konten Ridwan Kamil Virus Corona Corona Sembuh Corona Bandung Partai Demokrat Ridwan Kamil Kisruh Demokrat Kemelut Demokrat Bandung Agus Harimurti Partai Demokrat Ridwan Kamil Kisruh Demokrat Kemelut Demokrat Bandung Agus Harimurti PPKM Jawa Barat Ridwan Kamil Pemprov Jabar Bandung PPKM Jawa Barat Ridwan Kamil Pemprov Jabar Bandung Kasus Korupsi Kasus Suap Bupati Bogor KPK Rahmat Yasin Ditangkap KPK Bandung Kasus Korupsi Kasus Suap Bupati Bogor KPK Rahmat Yasin Ditangkap KPK Bandung Virus Corona Covid 19 Ridwan Kamil Corona Di Indonesia Corona Pemprov Jabar Bandung Virus Corona Covid 19 Ridwan Kamil Corona Di Indonesia Corona Pemprov Jabar Bandung Vaksin Covid 19 Vaksin Corona Ridwan Kamil Vaksin Sinovac Pemprov Jabar Bandung Vaksin Covid 19 Vaksin Corona Ridwan Kamil Vaksin Sinovac Pemprov Jabar Bandung Virus Corona Ridwan Kamil Karawang Corona Di Indonesia Corona Covid 19 Pemprov Jabar Bandung Virus Corona Ridwan Kamil Karawang Corona Di Indonesia Corona Covid 19 Pemprov Jabar Bandung,"Senin, 9 November 2015 18:45"
