Media_Online,Seed_URL,Parent,Anchor,Surrounding,Tanggal_Publish
merdeka,https://www.merdeka.com/uang/pengembangan-infrastruktur-geopark-ciletuh-butuh-sentuhan-tangan-pemerintah-pusat.html,"
Merdeka.com -  Kawasan wisata Geopark Ciletuh semakin ramai dikunjungi wisatawan. Namun, kawasan wisata andalan warga Sukabumi tersebut masih perlu perbaikan dari segi infrastruktur.
Sekretaris Daerah (Sekda) Kabupaten Sukabumi, Iyos Somantri mengatakan pengembangan kawasan Geopark Ciletuh Palabuhan Ratu, Kabupaten Sukabumi, Jawa Barat perlu bantuan dari pemerintah pusat dan Jawa Barat.
""Geopark ini sudah ditetapkan United Nations of Educational, Scientific and Cultural Organization (Unesco) sebagai geopark dunia, tentunya dalam pengembangan perlu bantuan dari pusat dan provinsi khususnya dalam perbaikan sarana dan prasarana infrastruktur,"" kata dia dikutip dari Antara, Minggu (25/8).
Saat ini pun Pemkab Sukabumi tidak berdiam diri. Pemkab terus memperbaiki insfrastruktur geopark karena menjadi andalan pihaknya dalam meningkatkan ekonomi masyarakat serta pendapatan asli daerah (PAD).
Keberadaan geopark ini tidak hanya sebatas pariwisata saja, tetapi di dalamnya ada pemberdayaan dan ekonomi masyarakat serta kehidupan sosial lainnya. Tentunya pengembangan kawasan ini harus ditunjang atau didukung insfrastruktur yang memadai.
Pihaknya mengapresiasi pemerintah pusat dan Provinsi Jabar yang terus memperhatikan keberadaan Geopark Ciletuh Palabuhanratu ini karena memiliki potensi yang besar untuk dimanfaatkan khususnya oleh warga.
""Dengan insfrastruktur yang memadai di kawasan geopark ini dapat mendorong peningkatan ekonomi masyarakat dari aspek kepariwisataan juga dan kehidupan sosial,"" ujarnya.
Iyos mengatakan dengan insfrastruktur yang baik juga bisa menarik investor datang ke Kabupaten Sukabumi untuk menanamkan modalnya khususnya di bidang pariwisata, namun pihaknya menginginkan setiap investasi yang masuk harus melibatkan warga sekitar.
Selain itu, diharapkan ke depannya bisa dibangun Jalan Tol Cibadak-Palabuhanratu untuk menunjang konektivitas perhubungan, apalagi saat ini sedang dibangun Jalan Tol Bogor-Ciawi-Sukabumi (Bocimi), jalur ganda kereta api Sukabumi-Bogor dan dalam waktu dekat juga akan dibangun Bandara Sukabumi. [azz]
",Pariwisata Indonesia Sukabumi Infrastruktur Ekonomi Indonesia Jakarta,Pariwisata Indonesia Kemenparekraf Ekonomi Indonesia Pertumbuhan Industri Jakarta Sandiaga Salahuddin Uno Pariwisata Indonesia Kemenparekraf Ekonomi Indonesia Pertumbuhan Industri Jakarta Sandiaga Salahuddin Uno Pariwisata Indonesia Sandiaga Uno Ekonomi Indonesia Kemenparekraf Jakarta Sandiaga Salahuddin Uno Pariwisata Indonesia Sandiaga Uno Ekonomi Indonesia Kemenparekraf Jakarta Sandiaga Salahuddin Uno Pariwisata Indonesia Virus Corona The New Normal Kemenparekraf Liputan6.com Ekonomi Indonesia Jakarta Dampak Corona Pariwisata Indonesia Virus Corona The New Normal Kemenparekraf Liputan6.com Ekonomi Indonesia Jakarta Dampak Corona Pariwisata Indonesia Covid 19 Ekonomi Indonesia Kemenparekraf Jakarta Virus Corona Dampak Corona Pariwisata Indonesia Covid 19 Ekonomi Indonesia Kemenparekraf Jakarta Virus Corona Dampak Corona Wisatawan Asing Pariwisata Indonesia Kemenparekraf Virus Corona Liputan6.com Ekonomi Indonesia Jakarta Wisatawan Asing Pariwisata Indonesia Kemenparekraf Virus Corona Liputan6.com Ekonomi Indonesia Jakarta Jawa Timur Jatim Berita Wisata Jatim Probolinggo Himalaya Nepal Pariwisata Indonesia Wisata Unik Yogyakarta Jawa Timur Jatim Berita Wisata Jatim Probolinggo Himalaya Nepal Pariwisata Indonesia Wisata Unik Yogyakarta Jatim Berita Banyuwangi Berita Banyuwangi Pariwisata Indonesia Wisata Jatim Puan Maharani Ketua DPR Puan Maharani Yogyakarta Jatim Berita Banyuwangi Berita Banyuwangi Pariwisata Indonesia Wisata Jatim Puan Maharani Ketua DPR Puan Maharani Yogyakarta UMKM UKM Pariwisata Indonesia Kemenparekraf Sandiaga Uno Ekonomi Indonesia Jakarta Sandiaga Salahuddin Uno UMKM UKM Pariwisata Indonesia Kemenparekraf Sandiaga Uno Ekonomi Indonesia Jakarta Sandiaga Salahuddin Uno Luhut Panjaitan Pariwisata Indonesia Jakarta Luhut Panjaitan Pariwisata Indonesia Jakarta Menko Perekonomian Airlangga Hartarto Pariwisata Indonesia Dampak Corona Jakarta Airlangga Hartarto Menko Perekonomian Airlangga Hartarto Pariwisata Indonesia Dampak Corona Jakarta Airlangga Hartarto Vaksin Covid 19 Bali Sandiaga Uno Pariwisata Indonesia Ekonomi Indonesia Jakarta Vaksin Corona Pariwisata Bali Kemenparekraf Vaksin Covid 19 Bali Sandiaga Uno Pariwisata Indonesia Ekonomi Indonesia Jakarta Vaksin Corona Pariwisata Bali Kemenparekraf BPS Pariwisata Bali Pariwisata Indonesia Dampak Corona Wisatawan Asing Jakarta BPS Pariwisata Bali Pariwisata Indonesia Dampak Corona Wisatawan Asing Jakarta Pariwisata Bali Virus Corona Ekonomi Indonesia Jakarta Dampak Corona Pariwisata Indonesia Pariwisata Bali Virus Corona Ekonomi Indonesia Jakarta Dampak Corona Pariwisata Indonesia Pariwisata Indonesia Bali Wisatawan Asing Sandiaga Uno Kemenparekraf Ekonomi Indonesia Jakarta Dampak Corona Pariwisata Indonesia Bali Wisatawan Asing Sandiaga Uno Kemenparekraf Ekonomi Indonesia Jakarta Dampak Corona Pariwisata Indonesia Infrastruktur Makassar Pariwisata Indonesia Infrastruktur Makassar BPS Pesawat Terbang Transportasi Umum Virus Corona Tes Corona Ekonomi Indonesia Pariwisata Indonesia Jakarta BPS Pesawat Terbang Transportasi Umum Virus Corona Tes Corona Ekonomi Indonesia Pariwisata Indonesia Jakarta Presiden Jokowi KRL Yogyakarta Solo Transportasi Umum Pariwisata Indonesia Pariwisata Yogyakarta Joko Widodo Presiden Jokowi KRL Yogyakarta Solo Transportasi Umum Pariwisata Indonesia Pariwisata Yogyakarta Joko Widodo Covid 19 Ingat Pesan Ibu Virus Corona Vaksin Covid 19 Vaksin Corona Pariwisata Indonesia Dampak Corona Sandiaga Uno Kemenparekraf Jakarta Sandiaga Salahuddin Uno Covid 19 Ingat Pesan Ibu Virus Corona Vaksin Covid 19 Vaksin Corona Pariwisata Indonesia Dampak Corona Sandiaga Uno Kemenparekraf Jakarta Sandiaga Salahuddin Uno Destinasi Wisata Wisata Jatim Ragam Jateng Mojokerto Jatim Pariwisata Indonesia Objek Wisata Lokasi Wisata Sejarah Yogyakarta Destinasi Wisata Wisata Jatim Ragam Jateng Mojokerto Jatim Pariwisata Indonesia Objek Wisata Lokasi Wisata Sejarah Yogyakarta Pencuri Motor Curanmor Sukabumi Pencuri Motor Curanmor Sukabumi Sarwo Edhie Wibowo Sukabumi TNI Aksi TNI Ragam Konten Trending Yogyakarta Sarwo Edhie Wibowo Sukabumi TNI Aksi TNI Ragam Konten Trending Yogyakarta Gempa  Gempa Bumi Ragam Konten Sukabumi Gempa  Gempa Bumi Ragam Konten Sukabumi Jabar Berita Sukabumi Covid 19 Satgas Covid 19 PPKM Pelanggaran PSBB PSBB Yogyakarta Jabar Berita Sukabumi Covid 19 Satgas Covid 19 PPKM Pelanggaran PSBB PSBB Yogyakarta Pergerakan Tanah Ragam Konten Sukabumi Pergerakan Tanah Ragam Konten Sukabumi Jabar Berita Cianjur Sukabumi Sejarah Cerita Sejarah Belanda  Agresi Belanda II Yogyakarta Jabar Berita Cianjur Sukabumi Sejarah Cerita Sejarah Belanda  Agresi Belanda II Yogyakarta Vaksin Covid 19 Vaksin Vaksin Corona Ragam Konten Satgas Covid 19 Covid 19 Sukabumi Vaksin Covid 19 Vaksin Vaksin Corona Ragam Konten Satgas Covid 19 Covid 19 Sukabumi Covid 19 Virus Corona Corona Di Indonesia Corona Sukabumi Covid 19 Virus Corona Corona Di Indonesia Corona Sukabumi Jabar Berita Garut Sukabumi Arab Saudi Pekerja Migran Yogyakarta Jabar Berita Garut Sukabumi Arab Saudi Pekerja Migran Yogyakarta Tahun Baru Natal 2020 Hiburan Malam Sukabumi Ragam Konten Hari Natal Jakarta Tahun Baru Natal 2020 Hiburan Malam Sukabumi Ragam Konten Hari Natal Jakarta Jabar Berita Sukabumi Lingkungan Hidup Pencemaran Lingkungan Limbah Yogyakarta Jabar Berita Sukabumi Lingkungan Hidup Pencemaran Lingkungan Limbah Yogyakarta Jabar Berita Sukabumi Covid 19 Cara Penanganan Covid 19 Mencegah Virus Corona Pakai Masker Yogyakarta Jabar Berita Sukabumi Covid 19 Cara Penanganan Covid 19 Mencegah Virus Corona Pakai Masker Yogyakarta Isolasi Covid 19 Ragam Konten Sukabumi Isolasi Covid 19 Ragam Konten Sukabumi Jabar Berita Ade Londok Sukabumi Yogyakarta Jabar Berita Ade Londok Sukabumi Yogyakarta Jabar Berita Sukabumi Bentrokan Ormas Yogyakarta Jabar Berita Sukabumi Bentrokan Ormas Yogyakarta Bentrokan Ormas Ragam Konten Sukabumi Bentrokan Ormas Ragam Konten Sukabumi Bentrokan Ormas Ragam Konten Sukabumi Bentrokan Ormas Ragam Konten Sukabumi Covid 19 Ragam Konten Sukabumi Covid 19 Ragam Konten Sukabumi Protokol Kesehatan Sukabumi Protokol Kesehatan Sukabumi Presiden Jokowi Bendungan Infrastruktur Jakarta Joko Widodo Presiden Jokowi Bendungan Infrastruktur Jakarta Joko Widodo Pariwisata Indonesia Infrastruktur Makassar Pariwisata Indonesia Infrastruktur Makassar Pembangunan Infrastruktur Infrastruktur Luhut Panjaitan Menko Kemaritiman Ekonomi Indonesia Jakarta Pembangunan Infrastruktur Infrastruktur Luhut Panjaitan Menko Kemaritiman Ekonomi Indonesia Jakarta Gibran Rakabuming Raka Gibran Gibran Rakabuming Gibran Rakabuming Anak Jokowi Infrastruktur Pembangunan Infrastruktur Ekonomi Indonesia Jakarta Gibran Rakabuming Raka Gibran Gibran Rakabuming Gibran Rakabuming Anak Jokowi Infrastruktur Pembangunan Infrastruktur Ekonomi Indonesia Jakarta Infrastruktur Pembangunan Infrastruktur Kementerian PUPR Ekonomi Indonesia Jakarta Infrastruktur Pembangunan Infrastruktur Kementerian PUPR Ekonomi Indonesia Jakarta PLN Listrik Kementerian ESDM Infrastruktur Ekonomi Indonesia Jakarta PLN Listrik Kementerian ESDM Infrastruktur Ekonomi Indonesia Jakarta Jalur Sepeda Jakarta Infrastruktur Pemprov DKI Jakarta Jalur Sepeda Jakarta Infrastruktur Pemprov DKI Jakarta Basuki Hadimuljono Kementerian PUPR Infrastruktur Tol Trans Sumatera Jakarta Basuki Hadimuljono Kementerian PUPR Infrastruktur Tol Trans Sumatera Jakarta Infrastruktur Pembangunan Infrastruktur Jakarta Infrastruktur Pembangunan Infrastruktur Jakarta Tol Cipali Infrastruktur Pembangunan Infrastruktur Jakarta Tol Cipali Infrastruktur Pembangunan Infrastruktur Jakarta Pelabuhan Kementerian Perhubungan Infrastruktur Ekonomi Indonesia Jakarta Budi Karya Sumadi Pelabuhan Kementerian Perhubungan Infrastruktur Ekonomi Indonesia Jakarta Budi Karya Sumadi Tol Jorr Tol Hutama Karya Infrastruktur Banjir BUMN Banjir Jakarta Jakarta Tol Jorr Tol Hutama Karya Infrastruktur Banjir BUMN Banjir Jakarta Jakarta Luhut Panjaitan Infrastruktur Pembangunan Infrastruktur Jakarta Luhut Panjaitan Infrastruktur Pembangunan Infrastruktur Jakarta Infrastruktur Digital Internet Sri Mulyani Indrawati Kemenkeu Virus Corona Ekonomi Indonesia Jakarta Infrastruktur Digital Internet Sri Mulyani Indrawati Kemenkeu Virus Corona Ekonomi Indonesia Jakarta Infrastruktur Jawa Barat Ridwan Kamil Pembangunan Infrastruktur Pemprov Jabar Air Bersih Jakarta Infrastruktur Jawa Barat Ridwan Kamil Pembangunan Infrastruktur Pemprov Jabar Air Bersih Jakarta Jokowi Minta Benci Produk Luar Negeri Ekspor Impor Ekonomi Indonesia Jakarta Jokowi Minta Benci Produk Luar Negeri Ekspor Impor Ekonomi Indonesia Jakarta Kurs Rupiah Rupiah Rupiah Merosot Ekonomi Indonesia Jakarta Kurs Rupiah Rupiah Rupiah Merosot Ekonomi Indonesia Jakarta Lembaga Pengelola Investasi Hutama Karya Tol Trans Sumatera Investasi Pembangunan Infrastruktur BUMN Ekonomi Indonesia Jakarta Lembaga Pengelola Investasi Hutama Karya Tol Trans Sumatera Investasi Pembangunan Infrastruktur BUMN Ekonomi Indonesia Jakarta Pemulihan Ekonomi Nasional Inklusi Keuangan Menko Perekonomian Airlangga Hartarto Ekonomi Indonesia Jakarta Pemulihan Ekonomi Nasional Inklusi Keuangan Menko Perekonomian Airlangga Hartarto Ekonomi Indonesia Jakarta Ekonomi Digital Luhut Panjaitan Pertumbuhan Ekonomi Ekonomi Indonesia Jakarta Ekonomi Digital Luhut Panjaitan Pertumbuhan Ekonomi Ekonomi Indonesia Jakarta Energi Baru Terbarukan Pedesaan Kementerian ESDM Ekonomi Indonesia Jakarta Energi Baru Terbarukan Pedesaan Kementerian ESDM Ekonomi Indonesia Jakarta Bioskop Dampak Corona Film Ekonomi Indonesia Jakarta Bioskop Dampak Corona Film Ekonomi Indonesia Jakarta Pajak Sri Mulyani Indrawati Pemulihan Ekonomi Nasional Ekonomi Indonesia Jakarta Pajak Sri Mulyani Indrawati Pemulihan Ekonomi Nasional Ekonomi Indonesia Jakarta SPT Tahunan SPT Pajak Sri Mulyani Indrawati Ekonomi Indonesia Jakarta SPT Tahunan SPT Pajak Sri Mulyani Indrawati Ekonomi Indonesia Jakarta UMKM Vaksinasi Covid 19 Kementerian Koperasi Dan UKM Koperasi Ekonomi Indonesia Jakarta UMKM Vaksinasi Covid 19 Kementerian Koperasi Dan UKM Koperasi Ekonomi Indonesia Jakarta Sertifikat Tanah Elektronik Kementerian Agraria Dan Tata Ruang Ekonomi Indonesia Jakarta Sertifikat Tanah Elektronik Kementerian Agraria Dan Tata Ruang Ekonomi Indonesia Jakarta Lembaga Pengelola Investasi Investasi Jasa Marga Tol Ekonomi Indonesia BUMN Jakarta Lembaga Pengelola Investasi Investasi Jasa Marga Tol Ekonomi Indonesia BUMN Jakarta BUMN Ekonomi Indonesia Jakarta BUMN Ekonomi Indonesia Jakarta Bank Indonesia Pertumbuhan Ekonomi Ekonomi Indonesia Jakarta Bank Indonesia Pertumbuhan Ekonomi Ekonomi Indonesia Jakarta Kurs Rupiah Rupiah Rupiah Merosot Ekonomi Indonesia Jakarta Kurs Rupiah Rupiah Rupiah Merosot Ekonomi Indonesia Jakarta Tol Lembaga Pengelola Investasi Investasi Infrastruktur Jasa Marga Ekonomi Indonesia BUMN Jakarta Tol Lembaga Pengelola Investasi Investasi Infrastruktur Jasa Marga Ekonomi Indonesia BUMN Jakarta Produk Indonesia HIPMI UMKM Ekonomi Indonesia Jakarta Produk Indonesia HIPMI UMKM Ekonomi Indonesia Jakarta Pemulihan Ekonomi Nasional Teknologi BPPT Presiden Jokowi Ekonomi Indonesia Jakarta Pemulihan Ekonomi Nasional Teknologi BPPT Presiden Jokowi Ekonomi Indonesia Jakarta Jokowi Minta Benci Produk Luar Negeri Produk Indonesia Sandiaga Uno UMKM Ekonomi Indonesia Jakarta Jokowi Minta Benci Produk Luar Negeri Produk Indonesia Sandiaga Uno UMKM Ekonomi Indonesia Jakarta Kemelut Demokrat Kisruh Demokrat Partai Demokrat KLB Demokrat Polri Jakarta Kemelut Demokrat Kisruh Demokrat Partai Demokrat KLB Demokrat Polri Jakarta Vaksin Covid 19 Jakarta Vaksin Covid 19 Jakarta BBM Premium SPBU Jakarta BBM Premium SPBU Jakarta Kementerian Kelautan Dan Perikanan Berita Kementerian KKP Jakarta Kementerian Kelautan Dan Perikanan Berita Kementerian KKP Jakarta PPKM Menko Perekonomian Airlangga Hartarto Pertumbuhan Ekonomi Ekonomi Indonesia Jakarta PPKM Menko Perekonomian Airlangga Hartarto Pertumbuhan Ekonomi Ekonomi Indonesia Jakarta China Muslim Uighur Uighur Xinjiang Ragam Konten Jakarta China Muslim Uighur Uighur Xinjiang Ragam Konten Jakarta Kemelut Demokrat Kisruh Demokrat Partai Demokrat KLB Demokrat Nazaruddin Moeldoko Ragam Konten Jakarta Kemelut Demokrat Kisruh Demokrat Partai Demokrat KLB Demokrat Nazaruddin Moeldoko Ragam Konten Jakarta KLB Demokrat Partai Demokrat Protokol Kesehatan Jakarta KLB Demokrat Partai Demokrat Protokol Kesehatan Jakarta Covid 19 Ingat Pesan Ibu Jakarta Covid 19 Ingat Pesan Ibu Jakarta Kemelut Demokrat Kisruh Demokrat Partai Demokrat KLB Demokrat Jakarta Kemelut Demokrat Kisruh Demokrat Partai Demokrat KLB Demokrat Jakarta Partai Demokrat KLB Demokrat Kisruh Demokrat Moeldoko AHY Jakarta Partai Demokrat KLB Demokrat Kisruh Demokrat Moeldoko AHY Jakarta Jasa Marga Mobil Listrik Tol Trans Jawa Jakarta Jasa Marga Mobil Listrik Tol Trans Jawa Jakarta Jokowi Minta Benci Produk Luar Negeri Ekspor Impor Ekonomi Indonesia Jakarta Jokowi Minta Benci Produk Luar Negeri Ekspor Impor Ekonomi Indonesia Jakarta Helena Lim Vaksin Covid 19 Vaksin Corona Vaksinasi Covid 19 Video Viral Viral Hari Ini VIRAL Jakarta Helena Lim Vaksin Covid 19 Vaksin Corona Vaksinasi Covid 19 Video Viral Viral Hari Ini VIRAL Jakarta Bank Permata Perbankan Jakarta Bank Permata Perbankan Jakarta Kisruh Demokrat Partai Demokrat KLB Demokrat Moeldoko Jakarta Kisruh Demokrat Partai Demokrat KLB Demokrat Moeldoko Jakarta Covid 19 Ingat Pesan Ibu Jakarta Covid 19 Ingat Pesan Ibu Jakarta Covid 19 Virus Corona DKI Jakarta Jakarta Covid 19 Virus Corona DKI Jakarta Jakarta,"Minggu, 25 Agustus 2019 11:26"
