Media_Online,Seed_URL,Parent,Anchor,Surrounding,Tanggal_Publish
tempo,https://travel.tempo.co/read/1081796/putra-putri-indonesia-promosikan-geopark-ciletuh-lewat-instagram,"
TEMPO.CO, Jakarta – UNESCO resmi menetapkan Geopark Ciletuh di Pelabuhanratu, Jawa Barat, sebagai bagian dari UNESCO Global Geopark atau UGG. Penetapan ini diumumkan saat sidang Excecutive Board UNESCO ke-204 di Paris, Prancis, Kamis, 12 April 2018.Menanggapi kabar tersebut, Putra-putri Pariwisata Jawa Barat langsung menyusun strategi untuk turut memasarkan kawasan wisata itu. “Saya pribadi akan mengandalkan media sosial sebagai langkah pertama promosi,” kata Putri Pariwisata Jawa Barat 2017 Nadhea Mutiara Rahayu kepada Tempo saat ditemui dalam acara audiensi Putra-putri Pariwisata dengan Menteri Pariwisata Arief Yahya di Gedung Sapta Pesona, Kementerian Pariwisata, Jakarta Pusat, Jumat, 20 April 2018.Baca juga: UNESCO Tetapkan Ciletuh-Palabuhanratu Sebagai Geopark DuniaMedia berbagi gambar Instagram, menurut Nadhea, merupakan sarana promosi paling efektif untuk mempopulerkan Geopark Ciletuh, yang sudah diakui dunia. Apalagi kini, ujar Dhea, mulai bermunculan akun media sosial wisata yang dikelola oleh anak-anak muda.


Pasar turis yang disasar Nadhea melalui Instagram ialah wisatawan Nusantara. “Kenalkan dulu ke wisatawan domestik supaya mereka tahu kalau Jawa Barat punya geopark kelas dunia,” ucapnya.Setali tiga uang dengan Nadhea, Putra Pariwisata Jawa Barat Galih Mandala juga bakal mempopulerkan kawasan Geopark Ciletuh lewat media sosial. Dia juga mendorong masyarakat lokal yang aktif mempromosikannya melalui jejaring dunia maya.Selain lewat media sosial, aksesibilitas dinilai penting untuk meningkatkan kunjungan wisatawan ke Geopark Cileteuh. “Sebab sekarang untuk menjangkau curug-curug masih cukup sulit,” ujar Nadhea.Artikel Lain: Rute Baru Menuju Geopark Ciletuh Lebih Pendek dan Indah



",Geopark Geropark Ciletuh Wisata Jawa Barat Instagram,geopark belitung Belitung Wisata Granit Pariwisata Geopark geopark belitung Belitung Wisata Granit Pariwisata Geopark Sandiaga Uno Arifin Tasrif Pariwisata Geopark Sandiaga Energi Terbarukan Sandiaga Uno Arifin Tasrif Pariwisata Geopark Sandiaga Energi Terbarukan Geopark Pegunungan UNESCO Geopark Pegunungan UNESCO Geopark Galunggung Tasikmalaya Geopark Galunggung Tasikmalaya Pariwisata Geopark Bappenas Pariwisata Geopark Bappenas Geopark Belitung Suharso Monoarfa Geopark Belitung Suharso Monoarfa Geopark Maros Pangkep Geopark UNESCO UNESCO Global Geopark Sulawesi Selatan Geopark Maros Pangkep Geopark UNESCO UNESCO Global Geopark Sulawesi Selatan Geopark Geopark Maros Pangkep Unhas Geopark Geopark Maros Pangkep Unhas Geotourism Festival 2020 Geopark Gunung Rinjani Geowisata Geotourism Festival 2020 Geopark Gunung Rinjani Geowisata Geopark UNESCO Geopark Run Series Geopark UNESCO Geopark Run Series Gunung Rinjani Plawangan Sembalun Geopark Gunung Rinjani Plawangan Sembalun Geopark Dieng Geopark Dieng Geopark gunung sewu Geopark UNESCO gunung sewu Geopark UNESCO Geopark Geopark Ciletuh Rinjani Geopark Geopark Ciletuh Rinjani Geopark Toba Belitung Geopark Toba Belitung gunung sewu Geopark UNESCO Yogyakarta Kabupaten Wonogiri gunung sewu Geopark UNESCO Yogyakarta Kabupaten Wonogiri Geopark Belitung Laskar Pelangi Geopark Belitung Laskar Pelangi Danau Toba UNESCO Geopark Pariwisata Danau Toba UNESCO Geopark Pariwisata Banyuwangi Menteri Pariwisata UNESCO Geopark Arief Yahya Banyuwangi Menteri Pariwisata UNESCO Geopark Arief Yahya Geopark Geopark Geopark Geosite Susur Gua Geopark Geosite Susur Gua Geopark Cina Geopark Cina Geopark Wisata Alam Geopark Wisata Alam Wisata Alam Geopark Ciletuh Geopark UNESCO Sukabumi Objek Wisata Wisata Alam Geopark Ciletuh Geopark UNESCO Sukabumi Objek Wisata Libur Maret 2021 Cuti Bersama COVID-19 Isra Miraj Cuti Bersama 2021 Libur Maret 2021 Cuti Bersama COVID-19 Isra Miraj Cuti Bersama 2021 Soeharto Yayasan Harapan Kita Bambang Trihatmodjo Mbak Tutut Pengadilan Negeri Keluarga Cendana Utang Sri Mulyani Soeharto Yayasan Harapan Kita Bambang Trihatmodjo Mbak Tutut Pengadilan Negeri Keluarga Cendana Utang Sri Mulyani Manny Pacquiao Tinju Dunia Jadwal Tinju WBA Mikey Garcia Tinju Berita Terkini Manny Pacquiao Tinju Dunia Jadwal Tinju WBA Mikey Garcia Tinju Berita Terkini AHY Demokrat KLB Demokrat Moeldoko Mahfud MD AHY Demokrat KLB Demokrat Moeldoko Mahfud MD Bank Panin Suap Pajak Pajak KPK Ditjen Pajak Bank Panin Suap Pajak Pajak KPK Ditjen Pajak Korupsi Sarana Jaya Pembangunan Sarana Jaya Yoory C. Pinontoan Rumah DP Nol DPRD DKI Korupsi Sarana Jaya Pembangunan Sarana Jaya Yoory C. Pinontoan Rumah DP Nol DPRD DKI Liga Champions Jadwal Liga Champions Juventus vs FC Porto Dortmund vs Sevilla Juventus Jadwal Bola Borussia Dortmund Sevilla FC Porto Jadwal Bola Hari Ini Jadwal Bola Malam Ini Jadwal Siaran Langsung Sepak Bola PSG vs Barcelona Liga Champions Jadwal Liga Champions Juventus vs FC Porto Dortmund vs Sevilla Juventus Jadwal Bola Borussia Dortmund Sevilla FC Porto Jadwal Bola Hari Ini Jadwal Bola Malam Ini Jadwal Siaran Langsung Sepak Bola PSG vs Barcelona Tinju Tinju Dunia Mike Tyson Jadwal Tinju Evander Holyfield Berita Terkini Tinju Tinju Dunia Mike Tyson Jadwal Tinju Evander Holyfield Berita Terkini AHY SBY KLB Demokrat Yasonna Demokrat AHY SBY KLB Demokrat Yasonna Demokrat THR THR PNS PNS Sri Mulyani Kementerian Keuangan THR THR PNS PNS Sri Mulyani Kementerian Keuangan sekolah tatap muka Bogor  vaksinasi Covid-19 Ade Yasin Bupati Bogor sekolah tatap muka Bogor  vaksinasi Covid-19 Ade Yasin Bupati Bogor sekolah tatap muka Bogor  vaksinasi Covid-19 Ade Yasin Bupati Bogor Aprilia Manganang Voli Bola Voli TNI AD Andika Perkasa Berllian Marsheilla Aprilia Manganang Voli Bola Voli TNI AD Andika Perkasa Berllian Marsheilla Aprilia Manganang Voli Bola Voli TNI AD Andika Perkasa Berllian Marsheilla Meadow Walker Givenchy Proenza Schouler Paris Fashion Week Fashion Show Paul Walker Meadow Walker Givenchy Proenza Schouler Paris Fashion Week Fashion Show Paul Walker Meadow Walker Givenchy Proenza Schouler Paris Fashion Week Fashion Show Paul Walker Penyakit Ginjal Ginjal gagal ginjal Kesehatan Transplantasi Ginjal Penyakit Ginjal Ginjal gagal ginjal Kesehatan Transplantasi Ginjal Penyakit Ginjal Ginjal gagal ginjal Kesehatan Transplantasi Ginjal RUU Pemilu Prolegnas Pemilu 2019 DPR DPD RUU Pemilu Prolegnas Pemilu 2019 DPR DPD RUU Pemilu Prolegnas Pemilu 2019 DPR DPD Barcelona PSG vs Barcelona PSG Paris Saint-Germain Ronald Koeman Liga Champions Barcelona PSG vs Barcelona PSG Paris Saint-Germain Ronald Koeman Liga Champions Barcelona PSG vs Barcelona PSG Paris Saint-Germain Ronald Koeman Liga Champions Kemenhub Budi Karya Kecelakaan Transportasi Kementerian Perhubungan Kemenhub Budi Karya Kecelakaan Transportasi Kementerian Perhubungan Kemenhub Budi Karya Kecelakaan Transportasi Kementerian Perhubungan Ahok Sarana Jaya Pondok Ranggon Lahan Cengkareng Barat KPK Ahok Sarana Jaya Pondok Ranggon Lahan Cengkareng Barat KPK Ahok Sarana Jaya Pondok Ranggon Lahan Cengkareng Barat KPK Kemnaker PHK Jokowi UU Cipta Kerja BPJS Kemnaker PHK Jokowi UU Cipta Kerja BPJS Kemnaker PHK Jokowi UU Cipta Kerja BPJS Kerajaan Inggris Inggris Ratu Elizabeth II Meghan Markle Pangeran Harry Pangeran Charles Boris Johnson Rasisme Kerajaan Inggris Inggris Ratu Elizabeth II Meghan Markle Pangeran Harry Pangeran Charles Boris Johnson Rasisme Kerajaan Inggris Inggris Ratu Elizabeth II Meghan Markle Pangeran Harry Pangeran Charles Boris Johnson Rasisme Geopark Geropark Ciletuh Wisata Jawa Barat Instagram Geopark Geropark Ciletuh Wisata Jawa Barat Instagram Libur Maret 2021 Cuti Bersama COVID-19 Isra Miraj Cuti Bersama 2021 Libur Maret 2021 Cuti Bersama COVID-19 Isra Miraj Cuti Bersama 2021 Soeharto Yayasan Harapan Kita Bambang Trihatmodjo Mbak Tutut Pengadilan Negeri Keluarga Cendana Utang Sri Mulyani Soeharto Yayasan Harapan Kita Bambang Trihatmodjo Mbak Tutut Pengadilan Negeri Keluarga Cendana Utang Sri Mulyani Manny Pacquiao Tinju Dunia Jadwal Tinju WBA Mikey Garcia Tinju Berita Terkini Manny Pacquiao Tinju Dunia Jadwal Tinju WBA Mikey Garcia Tinju Berita Terkini AHY Demokrat KLB Demokrat Moeldoko Mahfud MD AHY Demokrat KLB Demokrat Moeldoko Mahfud MD Bank Panin Suap Pajak Pajak KPK Ditjen Pajak Bank Panin Suap Pajak Pajak KPK Ditjen Pajak Korupsi Sarana Jaya Pembangunan Sarana Jaya Yoory C. Pinontoan Rumah DP Nol DPRD DKI Korupsi Sarana Jaya Pembangunan Sarana Jaya Yoory C. Pinontoan Rumah DP Nol DPRD DKI Liga Champions Jadwal Liga Champions Juventus vs FC Porto Dortmund vs Sevilla Juventus Jadwal Bola Borussia Dortmund Sevilla FC Porto Jadwal Bola Hari Ini Jadwal Bola Malam Ini Jadwal Siaran Langsung Sepak Bola PSG vs Barcelona Liga Champions Jadwal Liga Champions Juventus vs FC Porto Dortmund vs Sevilla Juventus Jadwal Bola Borussia Dortmund Sevilla FC Porto Jadwal Bola Hari Ini Jadwal Bola Malam Ini Jadwal Siaran Langsung Sepak Bola PSG vs Barcelona Tinju Tinju Dunia Mike Tyson Jadwal Tinju Evander Holyfield Berita Terkini Tinju Tinju Dunia Mike Tyson Jadwal Tinju Evander Holyfield Berita Terkini AHY SBY KLB Demokrat Yasonna Demokrat AHY SBY KLB Demokrat Yasonna Demokrat THR THR PNS PNS Sri Mulyani Kementerian Keuangan THR THR PNS PNS Sri Mulyani Kementerian Keuangan sekolah tatap muka Bogor  vaksinasi Covid-19 Ade Yasin Bupati Bogor sekolah tatap muka Bogor  vaksinasi Covid-19 Ade Yasin Bupati Bogor sekolah tatap muka Bogor  vaksinasi Covid-19 Ade Yasin Bupati Bogor Aprilia Manganang Voli Bola Voli TNI AD Andika Perkasa Berllian Marsheilla Aprilia Manganang Voli Bola Voli TNI AD Andika Perkasa Berllian Marsheilla Aprilia Manganang Voli Bola Voli TNI AD Andika Perkasa Berllian Marsheilla Meadow Walker Givenchy Proenza Schouler Paris Fashion Week Fashion Show Paul Walker Meadow Walker Givenchy Proenza Schouler Paris Fashion Week Fashion Show Paul Walker Meadow Walker Givenchy Proenza Schouler Paris Fashion Week Fashion Show Paul Walker Penyakit Ginjal Ginjal gagal ginjal Kesehatan Transplantasi Ginjal Penyakit Ginjal Ginjal gagal ginjal Kesehatan Transplantasi Ginjal Penyakit Ginjal Ginjal gagal ginjal Kesehatan Transplantasi Ginjal RUU Pemilu Prolegnas Pemilu 2019 DPR DPD RUU Pemilu Prolegnas Pemilu 2019 DPR DPD RUU Pemilu Prolegnas Pemilu 2019 DPR DPD Barcelona PSG vs Barcelona PSG Paris Saint-Germain Ronald Koeman Liga Champions Barcelona PSG vs Barcelona PSG Paris Saint-Germain Ronald Koeman Liga Champions Barcelona PSG vs Barcelona PSG Paris Saint-Germain Ronald Koeman Liga Champions Kemenhub Budi Karya Kecelakaan Transportasi Kementerian Perhubungan Kemenhub Budi Karya Kecelakaan Transportasi Kementerian Perhubungan Kemenhub Budi Karya Kecelakaan Transportasi Kementerian Perhubungan Ahok Sarana Jaya Pondok Ranggon Lahan Cengkareng Barat KPK Ahok Sarana Jaya Pondok Ranggon Lahan Cengkareng Barat KPK Ahok Sarana Jaya Pondok Ranggon Lahan Cengkareng Barat KPK Kemnaker PHK Jokowi UU Cipta Kerja BPJS Kemnaker PHK Jokowi UU Cipta Kerja BPJS Kemnaker PHK Jokowi UU Cipta Kerja BPJS Kerajaan Inggris Inggris Ratu Elizabeth II Meghan Markle Pangeran Harry Pangeran Charles Boris Johnson Rasisme Kerajaan Inggris Inggris Ratu Elizabeth II Meghan Markle Pangeran Harry Pangeran Charles Boris Johnson Rasisme Kerajaan Inggris Inggris Ratu Elizabeth II Meghan Markle Pangeran Harry Pangeran Charles Boris Johnson Rasisme West Java Calendar of Event Festival Ridwan Kamil Wisata Jawa Barat jawa barat West Java Calendar of Event Festival Ridwan Kamil Wisata Jawa Barat jawa barat Scan Barcode Cianjur Pariwisata Wisata Jawa Barat Ridwan Kamil Scan Barcode Cianjur Pariwisata Wisata Jawa Barat Ridwan Kamil Reaktif Covid-19 Wisatawan Rapid Test  Wisata Jawa Barat Reaktif Covid-19 Wisatawan Rapid Test  Wisata Jawa Barat Destinasi Wisata Tambang Wisata Jawa Barat Destinasi Wisata Tambang Wisata Jawa Barat Ridwan Kamil Festival Wisata Jawa Barat wisata Bandung Ridwan Kamil Festival Wisata Jawa Barat wisata Bandung Danny Pomanto Optimistis Program 'Makassar Recover' Putus Mata Rantai Covid-19 Kementan Terus Kawal Masa Panen Padi di Semua Wilayah Indonesia Reaksi Wali Kota Depok Varian Baru Covid-19 Sudah Datang: Kita Baru Dengar That's Why: Bongkar Strategi Bangun Desa ala Eko Putro Sandjojo (Sambil Menikmati BMW Seri 7) jawa barat Wisata Jawa Barat Danny Pomanto Optimistis Program 'Makassar Recover' Putus Mata Rantai Covid-19 Kementan Terus Kawal Masa Panen Padi di Semua Wilayah Indonesia Reaksi Wali Kota Depok Varian Baru Covid-19 Sudah Datang: Kita Baru Dengar That's Why: Bongkar Strategi Bangun Desa ala Eko Putro Sandjojo (Sambil Menikmati BMW Seri 7) jawa barat Wisata Jawa Barat Bunga Sakura Sumba Timur Wisata Jawa Barat Bunga Sakura Sumba Timur Wisata Jawa Barat Ridwan Kamil Wisata Jawa Barat Ridwan Kamil Wisata Jawa Barat Geopark Geropark Ciletuh Wisata Jawa Barat Instagram Geopark Geropark Ciletuh Wisata Jawa Barat Instagram Wisata Jawa Barat Wisata Jawa Barat Wisata Jawa Barat Wisata Jawa Barat Wisata Jawa Barat Wisata Jawa Barat Wisata Jawa Barat Wisata Jawa Barat Situs Purbakala Wisata Jawa Barat Situs Purbakala Wisata Jawa Barat Wisata Jawa Barat Lembaga Ilmu Pengetahuan Indonesia (LIPI) Wisata Jawa Barat Lembaga Ilmu Pengetahuan Indonesia (LIPI) Lingkungan Hidup Wisata Jawa Barat Bio Teknologi Lingkungan Hidup Wisata Jawa Barat Bio Teknologi Wisata Jawa Barat Wisata Jawa Barat Wisata Jawa Barat Kabupaten Bekasi Wisata Jawa Barat Kabupaten Bekasi Wisata Jawa Barat Kota Bandung Wisata Jawa Barat Kota Bandung Wisata Jawa Barat Wisata Jawa Barat Ciater Tempat Wisata Wisata Jawa Barat Ciater Tempat Wisata Wisata Jawa Barat Bioskop Bandung Wisata Jawa Barat Bioskop Bandung Wisata Jawa Barat Tempat Wisata Tempat Wisata Indonesia Wisata Jawa Barat Tempat Wisata Tempat Wisata Indonesia Wisata Jawa Barat Wisata Jawa Barat Bisnis Pariwisata | Turisme Wisata domestik Wisata Jawa Barat Bisnis Pariwisata | Turisme Wisata domestik Pantai Anyer Wisata Jawa Barat Tsunami Anyer Pantai Anyer Wisata Jawa Barat Tsunami Anyer Gunung Puntang Wisata Alam Wisata Jawa Barat Gunung Puntang Wisata Alam Wisata Jawa Barat Karnaval Wisata Jawa Barat Karnaval Wisata Jawa Barat Dilan Wisata Jawa Barat Dilan Wisata Jawa Barat Wisata Jawa Barat Wisata Jawa Barat Wisata Jawa Barat Wisata Jawa Barat Wisata Jawa Barat Wisata Jawa Barat Wisata Jawa Barat Wisata Jawa Barat Wisata Jawa Barat Wisata Jawa Barat Wisata Jawa Barat Wisata Jawa Barat Wisata Jawa Barat Wisata Jawa Barat Wisata Jawa Barat Wisata Jawa Barat Wisata Jawa Barat Wisata Jawa Barat Wisata Jawa Barat Wisata Jawa Barat Wisata Jawa Barat Wisata Jawa Barat Wisata Jawa Barat Wisata Jawa Barat berwisata Sawah terasering Revitalisasi Pertanian | Perkebunan Bawang Kabupaten Majalengka Wisata Jawa Barat Agrowisata Liburan Idul Adha berwisata Sawah terasering Revitalisasi Pertanian | Perkebunan Bawang Kabupaten Majalengka Wisata Jawa Barat Agrowisata Liburan Idul Adha Wisata Jawa Barat Wisata Jawa Barat Wisata Jawa Barat PT Pertamina (Persero) Wisata Jawa Barat PT Pertamina (Persero) Wisata Jawa Barat Wisata Jawa Barat Wisata Jawa Barat Wisata Jawa Barat Wisata Jawa Barat Wisata Jawa Barat Wisata Jawa Barat Wisata Jawa Barat Wisata Jawa Barat Presiden Sukarno Wisata Jawa Barat Presiden Sukarno Wisata Jawa Barat Wisata Jawa Barat Wisata Jawa Barat Wisata Jawa Barat Wisata Jawa Barat Wisata Jawa Barat Wisata Jawa Barat Wisata Jawa Barat Wisata Jawa Barat Wisata Jawa Barat Libur Maret 2021 Cuti Bersama COVID-19 Isra Miraj Cuti Bersama 2021 Libur Maret 2021 Cuti Bersama COVID-19 Isra Miraj Cuti Bersama 2021 Soeharto Yayasan Harapan Kita Bambang Trihatmodjo Mbak Tutut Pengadilan Negeri Keluarga Cendana Utang Sri Mulyani Soeharto Yayasan Harapan Kita Bambang Trihatmodjo Mbak Tutut Pengadilan Negeri Keluarga Cendana Utang Sri Mulyani Manny Pacquiao Tinju Dunia Jadwal Tinju WBA Mikey Garcia Tinju Berita Terkini Manny Pacquiao Tinju Dunia Jadwal Tinju WBA Mikey Garcia Tinju Berita Terkini AHY Demokrat KLB Demokrat Moeldoko Mahfud MD AHY Demokrat KLB Demokrat Moeldoko Mahfud MD Bank Panin Suap Pajak Pajak KPK Ditjen Pajak Bank Panin Suap Pajak Pajak KPK Ditjen Pajak Korupsi Sarana Jaya Pembangunan Sarana Jaya Yoory C. Pinontoan Rumah DP Nol DPRD DKI Korupsi Sarana Jaya Pembangunan Sarana Jaya Yoory C. Pinontoan Rumah DP Nol DPRD DKI Liga Champions Jadwal Liga Champions Juventus vs FC Porto Dortmund vs Sevilla Juventus Jadwal Bola Borussia Dortmund Sevilla FC Porto Jadwal Bola Hari Ini Jadwal Bola Malam Ini Jadwal Siaran Langsung Sepak Bola PSG vs Barcelona Liga Champions Jadwal Liga Champions Juventus vs FC Porto Dortmund vs Sevilla Juventus Jadwal Bola Borussia Dortmund Sevilla FC Porto Jadwal Bola Hari Ini Jadwal Bola Malam Ini Jadwal Siaran Langsung Sepak Bola PSG vs Barcelona Tinju Tinju Dunia Mike Tyson Jadwal Tinju Evander Holyfield Berita Terkini Tinju Tinju Dunia Mike Tyson Jadwal Tinju Evander Holyfield Berita Terkini AHY SBY KLB Demokrat Yasonna Demokrat AHY SBY KLB Demokrat Yasonna Demokrat THR THR PNS PNS Sri Mulyani Kementerian Keuangan THR THR PNS PNS Sri Mulyani Kementerian Keuangan Meadow Walker Givenchy Proenza Schouler Paris Fashion Week Fashion Show Paul Walker Meadow Walker Givenchy Proenza Schouler Paris Fashion Week Fashion Show Paul Walker Meadow Walker Givenchy Proenza Schouler Paris Fashion Week Fashion Show Paul Walker Penyakit Ginjal Ginjal gagal ginjal Kesehatan Transplantasi Ginjal Penyakit Ginjal Ginjal gagal ginjal Kesehatan Transplantasi Ginjal Penyakit Ginjal Ginjal gagal ginjal Kesehatan Transplantasi Ginjal RUU Pemilu Prolegnas Pemilu 2019 DPR DPD RUU Pemilu Prolegnas Pemilu 2019 DPR DPD RUU Pemilu Prolegnas Pemilu 2019 DPR DPD Barcelona PSG vs Barcelona PSG Paris Saint-Germain Ronald Koeman Liga Champions Barcelona PSG vs Barcelona PSG Paris Saint-Germain Ronald Koeman Liga Champions Barcelona PSG vs Barcelona PSG Paris Saint-Germain Ronald Koeman Liga Champions Kemenhub Budi Karya Kecelakaan Transportasi Kementerian Perhubungan Kemenhub Budi Karya Kecelakaan Transportasi Kementerian Perhubungan Kemenhub Budi Karya Kecelakaan Transportasi Kementerian Perhubungan Ahok Sarana Jaya Pondok Ranggon Lahan Cengkareng Barat KPK Ahok Sarana Jaya Pondok Ranggon Lahan Cengkareng Barat KPK Ahok Sarana Jaya Pondok Ranggon Lahan Cengkareng Barat KPK Kemnaker PHK Jokowi UU Cipta Kerja BPJS Kemnaker PHK Jokowi UU Cipta Kerja BPJS Kemnaker PHK Jokowi UU Cipta Kerja BPJS Kerajaan Inggris Inggris Ratu Elizabeth II Meghan Markle Pangeran Harry Pangeran Charles Boris Johnson Rasisme Kerajaan Inggris Inggris Ratu Elizabeth II Meghan Markle Pangeran Harry Pangeran Charles Boris Johnson Rasisme Kerajaan Inggris Inggris Ratu Elizabeth II Meghan Markle Pangeran Harry Pangeran Charles Boris Johnson Rasisme Bansos Covid-19 Korupsi Bansos Covid-19 BPK Achsanul Qosasi Kemensos Mensos Juliari Batubara Bansos Covid-19 Korupsi Bansos Covid-19 BPK Achsanul Qosasi Kemensos Mensos Juliari Batubara Bansos Covid-19 Korupsi Bansos Covid-19 BPK Achsanul Qosasi Kemensos Mensos Juliari Batubara Meghan Markle Pangeran Harry Wawancara Pangeran Harry - Meghan Markle dengan Oprah Oprah Winfrey Kate Middleton Meghan Markle Pangeran Harry Wawancara Pangeran Harry - Meghan Markle dengan Oprah Oprah Winfrey Kate Middleton Meghan Markle Pangeran Harry Wawancara Pangeran Harry - Meghan Markle dengan Oprah Oprah Winfrey Kate Middleton Kudanil Taman Safari Indonesia Sampah Plastik Instagram Video Viral Dokter Hewan Kudanil Taman Safari Indonesia Sampah Plastik Instagram Video Viral Dokter Hewan Facebook International women's day Instagram COVID-19 Gender UKM WhatsApp Facebook International women's day Instagram COVID-19 Gender UKM WhatsApp Shandy Aulia David Herbowo Suami rumah tangga Instagram Shandy Aulia David Herbowo Suami rumah tangga Instagram Tempo 50 Tahun Tempo tempo.co Koran Tempo Instagram Tempo 50 Tahun Tempo tempo.co Koran Tempo Instagram Prakerja Kartu Prakerja SMS Instagram kartu keluarga Prakerja Kartu Prakerja SMS Instagram kartu keluarga Penculikan Polres Metro Jakarta Selatan Cikarang Barat Bekasi Instagram Penculikan Polres Metro Jakarta Selatan Cikarang Barat Bekasi Instagram Lady Gaga Anjing Penculikan Tembakan Instagram Lady Gaga Anjing Penculikan Tembakan Instagram Ridwan Kamil Microsoft Warganet Instagram Video Ridwan Kamil Microsoft Warganet Instagram Video Nus Kei  Instagram John Kei Pengadilan Negeri Jakarta Barat Video Polda Metro Jaya  Nus Kei  Instagram John Kei Pengadilan Negeri Jakarta Barat Video Polda Metro Jaya  McD Sarinah McDonald's Restoran Cepat Saji Waralaba Instagram Jakarta McD Sarinah McDonald's Restoran Cepat Saji Waralaba Instagram Jakarta Ganjar Ganjar Pranowo UMKM Instagram Jawa Tengah Ganjar Ganjar Pranowo UMKM Instagram Jawa Tengah Zoom TikTok Video Kamera MacBook Instagram Zoom TikTok Video Kamera MacBook Instagram Hari Valentine Song Joong Ki Instagram Cokelat Hari Valentine Song Joong Ki Instagram Cokelat Smartwatch Facebook iPhone Apple Watch WhatsApp Instagram Smartwatch Facebook iPhone Apple Watch WhatsApp Instagram Facebook Instagram Malaysia Filipina PBB Hoax Vaksin COVID-19 Facebook Instagram Malaysia Filipina PBB Hoax Vaksin COVID-19 Cristiano Ronaldo Instagram Twitter Facebook Juventus Juventus FC Lionel Messi Cristiano Ronaldo Instagram Twitter Facebook Juventus Juventus FC Lionel Messi Instagram Imlek  Stiker Tahun Kerbau Logam Di Rumah Saja Instagram Imlek  Stiker Tahun Kerbau Logam Di Rumah Saja Instagram Reels TikTok Facebook Video Instagram Reels TikTok Facebook Video Vaksinasi Vaksin COVID-19 Kartu Vaksinasi Data Pribadi Media Sosial Instagram Vaksinasi Vaksin COVID-19 Kartu Vaksinasi Data Pribadi Media Sosial Instagram Ikke Nurjanah Ikke Nurjanah Menikah Lagi Suami Pernikahan Instagram Ikke Nurjanah Ikke Nurjanah Menikah Lagi Suami Pernikahan Instagram Wasit Rusia Sepak Bola Instagram Selebgram Wasit Rusia Sepak Bola Instagram Selebgram Destinasi Instagramable Senayan Park Wisata Instagramable Instagram Destinasi Instagramable Senayan Park Wisata Instagramable Instagram Alexis Sharkey Instagram Selebgram Tewas/Meninggal Alexis Sharkey Instagram Selebgram Tewas/Meninggal Shoumaya Tazkiyyah artis Sinetron Instagram Shoumaya Tazkiyyah artis Sinetron Instagram Edhy Prabowo Barang Mewah Instagram Edhy Prabowo Barang Mewah Instagram Paus Fransiskus Model Instagram Paus Fransiskus Model Instagram Vicky Prasetyo Kalina Ocktaranny  Kalina Oktarani Instagram Vicky Prasetyo Kalina Ocktaranny  Kalina Oktarani Instagram Cardi B Pesta Ulang Tahun Instagram Cardi B Pesta Ulang Tahun Instagram Marion Jola crop top Penyanyi Instagram Marion Jola crop top Penyanyi Instagram meme Komnas PA Instagram Netizen Media Sosial meme Komnas PA Instagram Netizen Media Sosial Youtuber Youtube Instagram Youtuber Youtube Instagram TikTok Instagram Wisata Instagramable instagramable Media Sosial TikTok Instagram Wisata Instagramable instagramable Media Sosial Jennifer Bachdim Selebgram Selebritas Indonesia Tantangan Instagram Jennifer Bachdim Selebgram Selebritas Indonesia Tantangan Instagram Laudya Cynthia Bella Engku Emran Cerai Instagram Laudya Cynthia Bella Engku Emran Cerai Instagram Kebun Binatang Ragunan Instagram Kebun Binatang Ragunan Instagram Kebun Binatang Ragunan Ragunan PSBB Jakarta PSBB Harimau Sumatera Instagram Kebun Binatang Ragunan Ragunan PSBB Jakarta PSBB Harimau Sumatera Instagram Edo Borne Hesti Purwadinata Instagram Edo Borne Hesti Purwadinata Instagram Taman Safari Instagram virus corona Corona Taman Safari Instagram virus corona Corona Wika Salim Instagram Wika Salim Instagram karantina diri Karantina Corona Instagram karantina diri Karantina Corona Instagram Facebook WhatsApp Instagram Facebook WhatsApp Instagram Instagram Fitur Instagram Instagram Fitur Instagram Internet Jaringan Internet Youtube Facebook Instagram Internet Jaringan Internet Youtube Facebook Instagram IGTV Instagram Facebook IGTV Instagram Facebook Video Viral TikTok Instagram Video Viral TikTok Instagram Instagram Instagram Malang Instagram Netizen Malang Instagram Netizen Vanessa Angel Instagram Prostitusi Online Vanessa Angel Instagram Prostitusi Online Anies Baswedan Petugas PPSU Gubernur DKI Jakarta Instagram Anies Baswedan Petugas PPSU Gubernur DKI Jakarta Instagram Instagram Bunuh Diri Malaysia Instagram Bunuh Diri Malaysia Video Viral Instagram Siswa Guru Viral Yogyakarta Video Viral Instagram Siswa Guru Viral Yogyakarta Instagram Kaleidoskop Kaleidoskop 2018 Instagram Kaleidoskop Kaleidoskop 2018 Awkarin Gempa Palu Donggala Palu Instagram Awkarin Gempa Palu Donggala Palu Instagram Tatjana Saphira Park Seo Joon Netizen Instagram Tatjana Saphira Park Seo Joon Netizen Instagram Ustad Abdul Somad Instagram Ustad Abdul Somad Instagram Instagram Instagram Libur Maret 2021 Cuti Bersama COVID-19 Isra Miraj Cuti Bersama 2021 Libur Maret 2021 Cuti Bersama COVID-19 Isra Miraj Cuti Bersama 2021 Soeharto Yayasan Harapan Kita Bambang Trihatmodjo Mbak Tutut Pengadilan Negeri Keluarga Cendana Utang Sri Mulyani Soeharto Yayasan Harapan Kita Bambang Trihatmodjo Mbak Tutut Pengadilan Negeri Keluarga Cendana Utang Sri Mulyani Manny Pacquiao Tinju Dunia Jadwal Tinju WBA Mikey Garcia Tinju Berita Terkini Manny Pacquiao Tinju Dunia Jadwal Tinju WBA Mikey Garcia Tinju Berita Terkini AHY Demokrat KLB Demokrat Moeldoko Mahfud MD AHY Demokrat KLB Demokrat Moeldoko Mahfud MD Bank Panin Suap Pajak Pajak KPK Ditjen Pajak Bank Panin Suap Pajak Pajak KPK Ditjen Pajak Korupsi Sarana Jaya Pembangunan Sarana Jaya Yoory C. Pinontoan Rumah DP Nol DPRD DKI Korupsi Sarana Jaya Pembangunan Sarana Jaya Yoory C. Pinontoan Rumah DP Nol DPRD DKI Liga Champions Jadwal Liga Champions Juventus vs FC Porto Dortmund vs Sevilla Juventus Jadwal Bola Borussia Dortmund Sevilla FC Porto Jadwal Bola Hari Ini Jadwal Bola Malam Ini Jadwal Siaran Langsung Sepak Bola PSG vs Barcelona Liga Champions Jadwal Liga Champions Juventus vs FC Porto Dortmund vs Sevilla Juventus Jadwal Bola Borussia Dortmund Sevilla FC Porto Jadwal Bola Hari Ini Jadwal Bola Malam Ini Jadwal Siaran Langsung Sepak Bola PSG vs Barcelona Tinju Tinju Dunia Mike Tyson Jadwal Tinju Evander Holyfield Berita Terkini Tinju Tinju Dunia Mike Tyson Jadwal Tinju Evander Holyfield Berita Terkini AHY SBY KLB Demokrat Yasonna Demokrat AHY SBY KLB Demokrat Yasonna Demokrat THR THR PNS PNS Sri Mulyani Kementerian Keuangan THR THR PNS PNS Sri Mulyani Kementerian Keuangan sekolah tatap muka Bogor  vaksinasi Covid-19 Ade Yasin Bupati Bogor sekolah tatap muka Bogor  vaksinasi Covid-19 Ade Yasin Bupati Bogor sekolah tatap muka Bogor  vaksinasi Covid-19 Ade Yasin Bupati Bogor Aprilia Manganang Voli Bola Voli TNI AD Andika Perkasa Berllian Marsheilla Aprilia Manganang Voli Bola Voli TNI AD Andika Perkasa Berllian Marsheilla Aprilia Manganang Voli Bola Voli TNI AD Andika Perkasa Berllian Marsheilla Meadow Walker Givenchy Proenza Schouler Paris Fashion Week Fashion Show Paul Walker Meadow Walker Givenchy Proenza Schouler Paris Fashion Week Fashion Show Paul Walker Meadow Walker Givenchy Proenza Schouler Paris Fashion Week Fashion Show Paul Walker Penyakit Ginjal Ginjal gagal ginjal Kesehatan Transplantasi Ginjal Penyakit Ginjal Ginjal gagal ginjal Kesehatan Transplantasi Ginjal Penyakit Ginjal Ginjal gagal ginjal Kesehatan Transplantasi Ginjal RUU Pemilu Prolegnas Pemilu 2019 DPR DPD RUU Pemilu Prolegnas Pemilu 2019 DPR DPD RUU Pemilu Prolegnas Pemilu 2019 DPR DPD Barcelona PSG vs Barcelona PSG Paris Saint-Germain Ronald Koeman Liga Champions Barcelona PSG vs Barcelona PSG Paris Saint-Germain Ronald Koeman Liga Champions Barcelona PSG vs Barcelona PSG Paris Saint-Germain Ronald Koeman Liga Champions Kemenhub Budi Karya Kecelakaan Transportasi Kementerian Perhubungan Kemenhub Budi Karya Kecelakaan Transportasi Kementerian Perhubungan Kemenhub Budi Karya Kecelakaan Transportasi Kementerian Perhubungan Ahok Sarana Jaya Pondok Ranggon Lahan Cengkareng Barat KPK Ahok Sarana Jaya Pondok Ranggon Lahan Cengkareng Barat KPK Ahok Sarana Jaya Pondok Ranggon Lahan Cengkareng Barat KPK Kemnaker PHK Jokowi UU Cipta Kerja BPJS Kemnaker PHK Jokowi UU Cipta Kerja BPJS Kemnaker PHK Jokowi UU Cipta Kerja BPJS Kerajaan Inggris Inggris Ratu Elizabeth II Meghan Markle Pangeran Harry Pangeran Charles Boris Johnson Rasisme Kerajaan Inggris Inggris Ratu Elizabeth II Meghan Markle Pangeran Harry Pangeran Charles Boris Johnson Rasisme Kerajaan Inggris Inggris Ratu Elizabeth II Meghan Markle Pangeran Harry Pangeran Charles Boris Johnson Rasisme,"Sabtu, 21 April 2018 15:35 WIB"
