Media_Online,Seed_URL,Parent,Anchor,Surrounding,Tanggal_Publish
tempo,https://nasional.tempo.co/read/872966/penambangan-dan-sampah-merusak-geopark-nasional-ciletuh,"
TEMPO.CO, Bandung—Badan Geologi mencatat sejumlah potensi kerusakan alam di wilayah Geopark Nasional Ciletuh, Kabupaten Sukabumi, Jawa Barat.Obyek wisata alam di pesisir selatan itu sedang dipromosikan sebagai kawasan Geopark Dunia ke United Nations Organization for Education, Science and Culture.Baca: Daerah Karst di Jawa Barat Perlu PerlindunganKepala Badan Geologi Ego Syahrial mengatakan, setidaknya ada empat faktor potensi kerusakan itu diantaranya berasal dari penambangan liar serta perilaku pengunjung.  Penambangan liar dan pembukaan lahan yang berlebihan di area Geopark Ciletuh menyebabkan sungai semakin keruh dan menimbulkan pencemaran lingkungan.“Penambangan tanpa ijin harus dihentikan, bahkan tambang resmi pun sebaiknya dibatasi atau tidak diperpanjang,” katanya Sabtu, 6 Mei 2017.Baca: Geopark Ciletuh Perimadona Baru Tempat Liburan di Jawa Barat Longsor dan kerusakan lahan serta lingkungan juga harus diantisipasi akibat perkembangan hunian. Untuk penginapan di lokasi sekitar situs geologi, Badan Geologi meminta agar tidak dibangun hotel bertingkat. “Cukup homestay yang ditingkatkan pelayanannya,” ujar Ego.  Pihak pengelola dan pemerintah daerah perlu mewaspadai pula sampah-sampah buangan pengunjung. Ego mencontohkan kasus sampah di Gunung Rinjani yang memprihatinkan dan beredar di media sosial.“Pengunjung yang berjubel dan tidak diatur waktu kunjungannya bisa menyebabkan kerusakan dan kecelakaan,” kata dia. Setelah menjadi inisiator Geopark Kaldera Batur dan Geopark Gunug Sewu menjadi Geopark Dunia, kini Badan Geologi menyokong kawasan Ciletuh-Pelabuhan Ratu untuk mendapat status sama. Geopark atau taman bumi merupakan konsep baru model pemanfaatan warisan kebumian untuk keberlangsungan hidup masyarakat lokal secara berkesinambungan. 


 Konsep gagasan UNESCO itu adalah mengembangkan kawasan geopark secara berkelanjutan dengan memadukan tiga keragaman, yaitu geologi, hayati, dan budaya. Badan Geologi sejak beberapa tahun lalu telah melakukan inventarisasi keragaman geologi sekaligus warisan geologi kawasan Ciletuh.  Dari sudut pandang kegeologian, ujar Ego, kawasan Ciletuh-Pelabuhan Ratu punya keunikan dan eksotika tersendiri, seperti Curug Cikaso yang menjadi salah satu lokasi favorit pengunjung.""Kawasan ini memberikan bukti terjadinya tumbukan lempeng tektonika (lempeng) samudera dengan lempeng benua,” kata dia.  ANWAR SISWADI



",Konservasi Alam,NTT Nusa Tenggara Timur Konservasi Alam Kota Kupang Wisata Alam NTT Nusa Tenggara Timur Konservasi Alam Kota Kupang Wisata Alam Hewan Langka Satwa Langka Komunitas Binatang Langka Bekasi Konservasi Alam Orangutan Hewan Langka Satwa Langka Komunitas Binatang Langka Bekasi Konservasi Alam Orangutan Pulau Siberut Eksploitasi Hutan Konservasi Alam Kepulauan Mentawai Pulau Siberut Eksploitasi Hutan Konservasi Alam Kepulauan Mentawai Tips  Wildlife Photography Tempo Institute Konservasi Alam Tips  Wildlife Photography Tempo Institute Konservasi Alam Harimau konservasi Konservasi Alam BKSDA Harimau konservasi Konservasi Alam BKSDA Konservasi Alam Konservasi Alam Konservasi Alam Kementerian Lingkungan Hidup dan Kehutanan Konservasi Alam Kementerian Lingkungan Hidup dan Kehutanan Konservasi Alam Konservasi Alam Konservasi Alam Kementerian Pekerjaan Umum Basuki Hadimuljono Konservasi Alam Kementerian Pekerjaan Umum Basuki Hadimuljono Konservasi Alam Konservasi Alam Konservasi Alam Ahmad Heryawan Konservasi Alam Ahmad Heryawan Konservasi Alam World Wide Fund for Nature | WWF Konservasi Alam World Wide Fund for Nature | WWF Konservasi Alam Jerman Konservasi Alam Jerman Konservasi Alam Badan Restorasi Gambut Nazir Foead Konservasi Alam Badan Restorasi Gambut Nazir Foead Konservasi Alam Konservasi Alam Konservasi Alam Kementerian Lingkungan Hidup dan Kehutanan Konservasi Alam Kementerian Lingkungan Hidup dan Kehutanan Konservasi Alam Cathay Pacific Hong Kong Konservasi Alam Cathay Pacific Hong Kong Konservasi Alam Lembaga Ilmu Pengetahuan Indonesia (LIPI) Kota Bogor Konservasi Alam Lembaga Ilmu Pengetahuan Indonesia (LIPI) Kota Bogor Konservasi Alam Lembaga Ilmu Pengetahuan Indonesia (LIPI) Kabupaten Gianyar Konservasi Alam Lembaga Ilmu Pengetahuan Indonesia (LIPI) Kabupaten Gianyar Konservasi Alam Lembaga Ilmu Pengetahuan Indonesia (LIPI) Kota Bogor Konservasi Alam Lembaga Ilmu Pengetahuan Indonesia (LIPI) Kota Bogor Konservasi Alam Konservasi Alam Konservasi Alam NASA Konservasi Alam NASA Konservasi Alam Konservasi Alam Konservasi Alam Konservasi Alam Konservasi Alam Konservasi Alam Konservasi Alam Konservasi Alam Konservasi Alam Konservasi Alam Konservasi Alam Konservasi Alam Konservasi Alam Konservasi Alam Konservasi Alam Konservasi Alam Jamur jamur putih Cina Konservasi Alam Jamur jamur putih Cina Konservasi Alam Pantai konservasi Konservasi Alam Malang Wisata Pantai konservasi Konservasi Alam Malang Wisata Hutan Mangrove konservasi Konservasi Alam Banjir Banjir Jakarta Muara Angke Sungai Hutan Mangrove konservasi Konservasi Alam Banjir Banjir Jakarta Muara Angke Sungai Kepala BNPB BNPB Karhutla Konservasi Alam Orangutan Kepala BNPB BNPB Karhutla Konservasi Alam Orangutan Konservasi Alam Konservasi Alam Konservasi Alam Konservasi Alam Konservasi Alam Konservasi Alam Konservasi Alam Konservasi Alam Konservasi Alam Konservasi Alam Konservasi Alam Konservasi Alam KLB Demokrat Nazaruddin Partai Demokrat Moeldoko AHY KLB Demokrat Nazaruddin Partai Demokrat Moeldoko AHY Libur Maret 2021 Cuti Bersama COVID-19 Isra Miraj Cuti Bersama 2021 Libur Maret 2021 Cuti Bersama COVID-19 Isra Miraj Cuti Bersama 2021 Julie Estelle gaun gaun pengantin Pernikahan Makeup Julie Estelle gaun gaun pengantin Pernikahan Makeup Soeharto Yayasan Harapan Kita Bambang Trihatmodjo Mbak Tutut Pengadilan Negeri Keluarga Cendana Utang Sri Mulyani Soeharto Yayasan Harapan Kita Bambang Trihatmodjo Mbak Tutut Pengadilan Negeri Keluarga Cendana Utang Sri Mulyani Manny Pacquiao Tinju Dunia Jadwal Tinju WBA Mikey Garcia Tinju Berita Terkini Manny Pacquiao Tinju Dunia Jadwal Tinju WBA Mikey Garcia Tinju Berita Terkini AHY Demokrat KLB Demokrat Moeldoko Mahfud MD AHY Demokrat KLB Demokrat Moeldoko Mahfud MD Bank Panin Suap Pajak Pajak KPK Ditjen Pajak Bank Panin Suap Pajak Pajak KPK Ditjen Pajak Korupsi Sarana Jaya Pembangunan Sarana Jaya Yoory C. Pinontoan Rumah DP Nol DPRD DKI Korupsi Sarana Jaya Pembangunan Sarana Jaya Yoory C. Pinontoan Rumah DP Nol DPRD DKI Tinju Tinju Dunia Mike Tyson Jadwal Tinju Evander Holyfield Berita Terkini Tinju Tinju Dunia Mike Tyson Jadwal Tinju Evander Holyfield Berita Terkini Liga Champions Jadwal Liga Champions Juventus vs FC Porto Dortmund vs Sevilla Juventus Jadwal Bola Borussia Dortmund Sevilla FC Porto Jadwal Bola Hari Ini Jadwal Bola Malam Ini Jadwal Siaran Langsung Sepak Bola PSG vs Barcelona Liga Champions Jadwal Liga Champions Juventus vs FC Porto Dortmund vs Sevilla Juventus Jadwal Bola Borussia Dortmund Sevilla FC Porto Jadwal Bola Hari Ini Jadwal Bola Malam Ini Jadwal Siaran Langsung Sepak Bola PSG vs Barcelona Meadow Walker Givenchy Proenza Schouler Paris Fashion Week Fashion Show Paul Walker Meadow Walker Givenchy Proenza Schouler Paris Fashion Week Fashion Show Paul Walker Meadow Walker Givenchy Proenza Schouler Paris Fashion Week Fashion Show Paul Walker Penyakit Ginjal Ginjal gagal ginjal Kesehatan Transplantasi Ginjal Penyakit Ginjal Ginjal gagal ginjal Kesehatan Transplantasi Ginjal Penyakit Ginjal Ginjal gagal ginjal Kesehatan Transplantasi Ginjal RUU Pemilu Prolegnas Pemilu 2019 DPR DPD RUU Pemilu Prolegnas Pemilu 2019 DPR DPD RUU Pemilu Prolegnas Pemilu 2019 DPR DPD Barcelona PSG vs Barcelona PSG Paris Saint-Germain Ronald Koeman Liga Champions Barcelona PSG vs Barcelona PSG Paris Saint-Germain Ronald Koeman Liga Champions Barcelona PSG vs Barcelona PSG Paris Saint-Germain Ronald Koeman Liga Champions Kemenhub Budi Karya Kecelakaan Transportasi Kementerian Perhubungan Kemenhub Budi Karya Kecelakaan Transportasi Kementerian Perhubungan Kemenhub Budi Karya Kecelakaan Transportasi Kementerian Perhubungan Ahok Sarana Jaya Pondok Ranggon Lahan Cengkareng Barat KPK Ahok Sarana Jaya Pondok Ranggon Lahan Cengkareng Barat KPK Ahok Sarana Jaya Pondok Ranggon Lahan Cengkareng Barat KPK Kemnaker PHK Jokowi UU Cipta Kerja BPJS Kemnaker PHK Jokowi UU Cipta Kerja BPJS Kemnaker PHK Jokowi UU Cipta Kerja BPJS Kerajaan Inggris Inggris Ratu Elizabeth II Meghan Markle Pangeran Harry Pangeran Charles Boris Johnson Rasisme Kerajaan Inggris Inggris Ratu Elizabeth II Meghan Markle Pangeran Harry Pangeran Charles Boris Johnson Rasisme Kerajaan Inggris Inggris Ratu Elizabeth II Meghan Markle Pangeran Harry Pangeran Charles Boris Johnson Rasisme Bansos Covid-19 Korupsi Bansos Covid-19 BPK Achsanul Qosasi Kemensos Mensos Juliari Batubara Bansos Covid-19 Korupsi Bansos Covid-19 BPK Achsanul Qosasi Kemensos Mensos Juliari Batubara Bansos Covid-19 Korupsi Bansos Covid-19 BPK Achsanul Qosasi Kemensos Mensos Juliari Batubara Meghan Markle Pangeran Harry Wawancara Pangeran Harry - Meghan Markle dengan Oprah Oprah Winfrey Kate Middleton Meghan Markle Pangeran Harry Wawancara Pangeran Harry - Meghan Markle dengan Oprah Oprah Winfrey Kate Middleton Meghan Markle Pangeran Harry Wawancara Pangeran Harry - Meghan Markle dengan Oprah Oprah Winfrey Kate Middleton,"Minggu, 7 Mei 2017 07:27 WIB"
tempo,https://travel.tempo.co/read/1079922/unesco-tetapkan-ciletuh-palabuhanratu-sebagai-geopark-dunia,"
TEMPO.CO, Bandung - Gubernur Jawa Barat Ahmad Heryawan mengatakan, kawasan geopark Ciletuh Pelabuhanratu ditetapkan menjadi UNESCO Global Geopark. ""Dua hari lalu kita dapat kabar dari Sidang UNESCO di Paris, Perancis. Unesco sudah bersepakat menetapkan beberapa geopark di dunia,"" kata Aher, sapaan Ahmad Heryawan, dikutip dari rilis yang diterima Tempo dari Humas Pemprov Jabar, Minggu, 15 April 2018.Geopark Ciletuh-Pelabuhanratu mendapat pengesahan sebagai bagian dari jaringan Global Geopark bersama 12 geopark lainnya dalam salah satu sidang komisi di Executive Board Unesco ke 204 di Paris, Perancis pada 14 April 2018. Kabar itu diperoleh Aher dari Kepala Dinas Pariwisata Kabupaten Sukabumi yan gmengikuti sidang pengesahan tersebut.Aher mengumumkan pengesahan UGG Ciletuh-Palabuhanratu saat membuka Fun Day Towards UNESCO Global Geopark di Pantai Palangpang, Desa Ciwaru, Kecamatan Ciemas, Kabupaten Sukabumi, Minggu, 15 April 2018. Dalam sidang UNESCO tersebut dua geopark di Indonesia mendapat pengesahan sebagai UNESCO Global Geopark yakni Geopark Ciletuh-Palabuhanratu dan Geopark Rinjani di Nusat Tenggara Barat. “Dua diantaranya dari Indonesia,” kata dia.Aher mengatakan, pengesahan Geopark Ciletuh-Palabuhanratu masuk dalam jaringan Geopark Dunia itu relatif cepat. Kawasan Ciletuh-Palabuhanratu sendiri ditetapkan sebagai geopark nasional belum lama. “Tiga tahun lalu Geopark Ciletuh-Palabuhanratu ditetapkan sebagai Geopark Nasional oleh pemerintah pusat dan langsung kita ajukan pada UGG (UNESCO Global Geopark). Alhamdulillah diterima,” kata dia.


Aher mengatakan, sertifikat Geopark Ciletuh-Palabuhanratu dalam jaringan UGG itu akan diserahkan pada September 2018 nanti. “Keputusannya sudah ada, sertifikatnya akan diberikan secara bersama-sama di Portugal,” kata dia.Dengan penetapan itu, Aher meminta komitmen semua pihak untuk memelihara Geopark Ciletuh-Palabuanratu yang juga ditetapkan pemerintah Jawa Barat sebagai destinasi wisata unggulan. Pemerintah provinsi Jawa Barat sudah menggelontorkan Rp 96 miliar pada 2016 untuk membangun jalan dari pintu masuk kawasan geopark itu sejak dari Waluran. Pada 2017 pembangunan jalan dilanjutkan dari pintu masuk Loji menuju kawasan geopark dengan anggaran menembus Rp 217 miliar. Tahun ini pemerintah Jawa Barat menambah lagi Rp 90 miliar untuk membangun jalan menuju kawasn geopark tersebut dari arah Paltiga.Aher mengatakan, pemerintah pusat juga sudah menyiapkan pembangunan bandara Sukabumi untuk menyokong Geopark Ciletuh-Palabuhanratu. “Termasuk pembangunan bandara di Sukabumi, karena salah satu syarat geopark internasional itu, harus ada bandara dekat geopark dengan jarak tempuh maksimal tiga jam perjalanan,” kata dia.Aher meminta pemerintah kabupaten Sukabumi menuntaskan rencana detil tata ruang untuk menyokong geopark tersebut. “Saya minta Pak Bupati untuk segera Kabupatem Sukabumi menetapkan RDTR sebagai penjabaran lebih lanjut dari Perda Rencana Umum Tata Ruang Wilayah,” kata dia.Bupati Sukabumi Marwan Hamami berharap penetapan UGG bagi Geopark Ciletuh-Palabuhanratu itu bisa mendongkrak pembangunan kawasan selatan Jawa Barat. “Ini tantangan dan peluang untuk generasi zaman now,” kata dia, dikutip dari rilis tersebut, Minggu, 15 April 2018.AHMAD FIKRIArtikel lain: Viral Karena Tarian Erotis, Berikut 3 Fakta Mengenai Pantai Kartini Jepara



",Geopark,geopark belitung Belitung Wisata Granit Pariwisata Geopark geopark belitung Belitung Wisata Granit Pariwisata Geopark Sandiaga Uno Arifin Tasrif Pariwisata Geopark Sandiaga Energi Terbarukan Sandiaga Uno Arifin Tasrif Pariwisata Geopark Sandiaga Energi Terbarukan Geopark Pegunungan UNESCO Geopark Pegunungan UNESCO Geopark Galunggung Tasikmalaya Geopark Galunggung Tasikmalaya Pariwisata Geopark Bappenas Pariwisata Geopark Bappenas Geopark Belitung Suharso Monoarfa Geopark Belitung Suharso Monoarfa Geopark Maros Pangkep Geopark UNESCO UNESCO Global Geopark Sulawesi Selatan Geopark Maros Pangkep Geopark UNESCO UNESCO Global Geopark Sulawesi Selatan Geopark Geopark Maros Pangkep Unhas Geopark Geopark Maros Pangkep Unhas Geotourism Festival 2020 Geopark Gunung Rinjani Geowisata Geotourism Festival 2020 Geopark Gunung Rinjani Geowisata Geopark UNESCO Geopark Run Series Geopark UNESCO Geopark Run Series Gunung Rinjani Plawangan Sembalun Geopark Gunung Rinjani Plawangan Sembalun Geopark Dieng Geopark Dieng Geopark gunung sewu Geopark UNESCO gunung sewu Geopark UNESCO Geopark Geopark Ciletuh Rinjani Geopark Geopark Ciletuh Rinjani Geopark Toba Belitung Geopark Toba Belitung gunung sewu Geopark UNESCO Yogyakarta Kabupaten Wonogiri gunung sewu Geopark UNESCO Yogyakarta Kabupaten Wonogiri Geopark Belitung Laskar Pelangi Geopark Belitung Laskar Pelangi Danau Toba UNESCO Geopark Pariwisata Danau Toba UNESCO Geopark Pariwisata Banyuwangi Menteri Pariwisata UNESCO Geopark Arief Yahya Banyuwangi Menteri Pariwisata UNESCO Geopark Arief Yahya Geopark Geopark Geopark Geosite Susur Gua Geopark Geosite Susur Gua Geopark Cina Geopark Cina Geopark Wisata Alam Geopark Wisata Alam Wisata Alam Geopark Ciletuh Geopark UNESCO Sukabumi Objek Wisata Wisata Alam Geopark Ciletuh Geopark UNESCO Sukabumi Objek Wisata KLB Demokrat Nazaruddin Partai Demokrat Moeldoko AHY KLB Demokrat Nazaruddin Partai Demokrat Moeldoko AHY Libur Maret 2021 Cuti Bersama COVID-19 Isra Miraj Cuti Bersama 2021 Libur Maret 2021 Cuti Bersama COVID-19 Isra Miraj Cuti Bersama 2021 Julie Estelle gaun gaun pengantin Pernikahan Makeup Julie Estelle gaun gaun pengantin Pernikahan Makeup Soeharto Yayasan Harapan Kita Bambang Trihatmodjo Mbak Tutut Pengadilan Negeri Keluarga Cendana Utang Sri Mulyani Soeharto Yayasan Harapan Kita Bambang Trihatmodjo Mbak Tutut Pengadilan Negeri Keluarga Cendana Utang Sri Mulyani Manny Pacquiao Tinju Dunia Jadwal Tinju WBA Mikey Garcia Tinju Berita Terkini Manny Pacquiao Tinju Dunia Jadwal Tinju WBA Mikey Garcia Tinju Berita Terkini AHY Demokrat KLB Demokrat Moeldoko Mahfud MD AHY Demokrat KLB Demokrat Moeldoko Mahfud MD Bank Panin Suap Pajak Pajak KPK Ditjen Pajak Bank Panin Suap Pajak Pajak KPK Ditjen Pajak Korupsi Sarana Jaya Pembangunan Sarana Jaya Yoory C. Pinontoan Rumah DP Nol DPRD DKI Korupsi Sarana Jaya Pembangunan Sarana Jaya Yoory C. Pinontoan Rumah DP Nol DPRD DKI Tinju Tinju Dunia Mike Tyson Jadwal Tinju Evander Holyfield Berita Terkini Tinju Tinju Dunia Mike Tyson Jadwal Tinju Evander Holyfield Berita Terkini Liga Champions Jadwal Liga Champions Juventus vs FC Porto Dortmund vs Sevilla Juventus Jadwal Bola Borussia Dortmund Sevilla FC Porto Jadwal Bola Hari Ini Jadwal Bola Malam Ini Jadwal Siaran Langsung Sepak Bola PSG vs Barcelona Liga Champions Jadwal Liga Champions Juventus vs FC Porto Dortmund vs Sevilla Juventus Jadwal Bola Borussia Dortmund Sevilla FC Porto Jadwal Bola Hari Ini Jadwal Bola Malam Ini Jadwal Siaran Langsung Sepak Bola PSG vs Barcelona Meadow Walker Givenchy Proenza Schouler Paris Fashion Week Fashion Show Paul Walker Meadow Walker Givenchy Proenza Schouler Paris Fashion Week Fashion Show Paul Walker Meadow Walker Givenchy Proenza Schouler Paris Fashion Week Fashion Show Paul Walker Penyakit Ginjal Ginjal gagal ginjal Kesehatan Transplantasi Ginjal Penyakit Ginjal Ginjal gagal ginjal Kesehatan Transplantasi Ginjal Penyakit Ginjal Ginjal gagal ginjal Kesehatan Transplantasi Ginjal RUU Pemilu Prolegnas Pemilu 2019 DPR DPD RUU Pemilu Prolegnas Pemilu 2019 DPR DPD RUU Pemilu Prolegnas Pemilu 2019 DPR DPD Barcelona PSG vs Barcelona PSG Paris Saint-Germain Ronald Koeman Liga Champions Barcelona PSG vs Barcelona PSG Paris Saint-Germain Ronald Koeman Liga Champions Barcelona PSG vs Barcelona PSG Paris Saint-Germain Ronald Koeman Liga Champions Kemenhub Budi Karya Kecelakaan Transportasi Kementerian Perhubungan Kemenhub Budi Karya Kecelakaan Transportasi Kementerian Perhubungan Kemenhub Budi Karya Kecelakaan Transportasi Kementerian Perhubungan Ahok Sarana Jaya Pondok Ranggon Lahan Cengkareng Barat KPK Ahok Sarana Jaya Pondok Ranggon Lahan Cengkareng Barat KPK Ahok Sarana Jaya Pondok Ranggon Lahan Cengkareng Barat KPK Kemnaker PHK Jokowi UU Cipta Kerja BPJS Kemnaker PHK Jokowi UU Cipta Kerja BPJS Kemnaker PHK Jokowi UU Cipta Kerja BPJS Kerajaan Inggris Inggris Ratu Elizabeth II Meghan Markle Pangeran Harry Pangeran Charles Boris Johnson Rasisme Kerajaan Inggris Inggris Ratu Elizabeth II Meghan Markle Pangeran Harry Pangeran Charles Boris Johnson Rasisme Kerajaan Inggris Inggris Ratu Elizabeth II Meghan Markle Pangeran Harry Pangeran Charles Boris Johnson Rasisme Bansos Covid-19 Korupsi Bansos Covid-19 BPK Achsanul Qosasi Kemensos Mensos Juliari Batubara Bansos Covid-19 Korupsi Bansos Covid-19 BPK Achsanul Qosasi Kemensos Mensos Juliari Batubara Bansos Covid-19 Korupsi Bansos Covid-19 BPK Achsanul Qosasi Kemensos Mensos Juliari Batubara Meghan Markle Pangeran Harry Wawancara Pangeran Harry - Meghan Markle dengan Oprah Oprah Winfrey Kate Middleton Meghan Markle Pangeran Harry Wawancara Pangeran Harry - Meghan Markle dengan Oprah Oprah Winfrey Kate Middleton Meghan Markle Pangeran Harry Wawancara Pangeran Harry - Meghan Markle dengan Oprah Oprah Winfrey Kate Middleton,"Senin, 16 April 2018 09:59 WIB"
